username,text
lisadaniels3,My private photos and videos are here -- subscribe at my FanCentro profile https://t.co/ddqHXF0vpG! https://t.co/U10ZOMYmdJ
lisadaniels3,Someone is FAN enough! My profile https://t.co/mEU0CD14I4 has a loyal six month follower! https://t.co/ekDzEw8cVJ
lisadaniels3,"OMG, my FanCentro Feed is so much fun! Come hang with me now! https://t.co/rCsvdzB4ra. https://t.co/NNkPyTGaKI"
lisadaniels3,"I KNOW HE IS SPYING ON ME SO IM TEASING HIM WITH MY ASS AND TITS 

IF YOUR A... https://t.co/JzFrDhmkmy"
lisadaniels3,DURING HIS LUNCH BREAK I SUCKED THAT COCK TIL I GOT HIS CUM AND DRAINED HIS BALL... https://t.co/JzFrDhmkmy
lisadaniels3,My personal FanCentro profile https://t.co/yt2AOi4atn has a lot to offer. Come see it now! https://t.co/JfUCq72kl6
lisadaniels3,Need a pick-me-up? Come check out the new post on my FanCentro Feed at https://t.co/oIK4kR3fnn. https://t.co/r0nD2SjSoW
lisadaniels3,My premium subscriptions are so much fun! Subscribe at my FanCentro profile https://t.co/CRcTqkJTqf to be a part of... https://t.co/OAgAkabZa0
lisadaniels3,&lt;Waving&gt; Hey loyal fan! Thanks for sticking by me for six months! https://t.co/xQFrHtGNJT https://t.co/uXymB1tOT6
lisadaniels3,WATCH MY NEW YOUTUBE VIDEO NOW . GO SUBSCRIBE https://t.co/OSx05ojBAf https://t.co/joJIOMHToa
lisadaniels3,There's all new content on my FanCentro Feed! Check out my latest post at https://t.co/hu7XOljPRn. https://t.co/Z6otdSg989
lisadaniels3,Subscribe to see me at https://t.co/1jxGUAzyGC. I know you'll want to stay. https://t.co/ZArB1RNJm4
lisadaniels3,I love getting new subscribers to https://t.co/6os2L0v1ki. Lucky me--I got another one today! https://t.co/jPjS2fMY0y
lisadaniels3,That's one more subscriber to my profile https://t.co/h2YJ52rTPr! I love new faces! https://t.co/O9InvxIvRl
lisadaniels3,Another awesome subscriber just rebilled on https://t.co/VWhZLyoV36. I can't wait to show you what's next! https://t.co/Yg3LFV5yek
lisadaniels3,"FINGER FUCKING MY ASS  

IF YOUR A NEW MEMBER AND WOULD LIKE TO WATCH FULL VI... https://t.co/JzFrDhmkmy"
lisadaniels3,Curious about my profile? Subscribe at https://t.co/hXNufKK7Bh! https://t.co/x5ithssRBC
lisadaniels3,I got a rebill on my profile https://t.co/wiq6NTDdVR from an awesome fan! https://t.co/vZUwBHceBM
lisadaniels3,"My FanCentro Feed is full of awesome, exclusive content. I just posted something new, so don't miss out!... https://t.co/5BkXofyWaR"
lisadaniels3,"I TOLD HIM TO STICK IT IN HERE   AND GIVE ME YOUR HUGE CUM LOAD 
ONE NIGHT ST... https://t.co/JzFrDhmkmy"
lisadaniels3,YOU could be my newest subscriber at https://t.co/ycjMd5OolT! I'm waiting to say hello. https://t.co/ywT0hxwjrP
lisadaniels3,"HE FUCK ME AND CAME SO HARD ON MY FACE THAT IT GOT IN MY EYE 

IF YOUR A NEW... https://t.co/JzFrDhmkmy"
lisadaniels3,"RT @AboutVirgos: #Virgos love hard, so feelings die slowly... but once they are dead, there is no resurrection."
lisadaniels3,RT @AboutVirgos: #Virgos believes in loyalty and expects it in return.
lisadaniels3,"RT @AboutVirgos: #Virgos may not approve but, theyll never judge you, they are very understanding especially with people close to them."
lisadaniels3,"RT @AboutVirgos: A #Virgo won't tell you what you want to hear, they tell you what you need to hear."
lisadaniels3,I just posted something on my FanCentro Feed! Go there now! https://t.co/JMcrBf8qAs. https://t.co/2DbkRTy1TN
lisadaniels3,Love my incredible fans! Today I'm saying thanks to one special fan who has been following https://t.co/xibwm7gY9F... https://t.co/pUg3bDKHFi
lisadaniels3,"STOP MISSING OUT, JUST TRY IT OUT FOR 1 MONTH. YOU WON'T REGRET IT 
https://t.co/Hp1v2XyFYX... https://t.co/lMlcxahxzz"
lisadaniels3,"STOP MISSING OUT, JUST TRY IT OUT FOR 1 MONTH. YOU WON'T REGRET IT 
https://t.co/Hp1v2XyFYX... https://t.co/jZzKr0DTax"
lisadaniels3,"STOP MISSING OUT, JUST TRY IT OUT FOR 1 MONTH. YOU WON'T REGRET IT 
https://t.co/Hp1v2XyFYX... https://t.co/1MxfHFIHxS"
lisadaniels3,I love my fans! That's why I just posted something all-new to my Feed! Check it out at https://t.co/xxD3kJhCRa. https://t.co/FzWodytPPP
lisadaniels3,Hey! My super exclusive content is waiting for you at https://t.co/tln4l17kCL. Subscribe today! https://t.co/SDgVRIQCzK
lisadaniels3,"When my fans are happy, so am I -- I'd like to thank the loyal fan who has been with me for six months :)... https://t.co/WCa8TVy9GU"
lisadaniels3,"UPGRADE NOW 
https://t.co/Hp1v2Xh57p

UPGRADE NOW 
https://t.co/Hp1v2Xh57p

UPGRADE NOW 
https://t.co/Hp1v2Xh57p https://t.co/JR6r5CHHNl"
lisadaniels3,Get 3 videos today when you upgrade to my VIP no locked videos. This is only available for new subscribers and its... https://t.co/C3PlMHH09P
lisadaniels3,"FOLLOW MY SEXY RIGHT NOW 
@yin_samurai 
@yin_samurai 

@yin_samurai

@yin_samurai

@yin_samurai https://t.co/El5imLYxzw"
lisadaniels3,"FOLLOW MY SEXY RIGHT NOW 
@yin_samurai 
@yin_samurai 

@yin_samurai

@yin_samurai

@yin_samurai https://t.co/77Ywgpak1v"
lisadaniels3,"FOLLOW MY SEXY RIGHT NOW 
@yin_samurai 
@yin_samurai 

@yin_samurai

@yin_samurai

@yin_samurai https://t.co/P22ftGoJ9E"
lisadaniels3,Get 3 videos today when you upgrade to my VIP no locked videos. This is only available for new subscribers and its... https://t.co/gVgJ7s3Di3
lisadaniels3,That's one more subscriber to my profile https://t.co/h2YJ52rTPr! I love new faces! https://t.co/TYAafqKt2O
lisadaniels3,YOU could be my newest subscriber at https://t.co/ycjMd5OolT! I'm waiting to say hello. https://t.co/6Nrr3Tx1sd
lisadaniels3,&lt;Waving&gt; Hey loyal fan! Thanks for sticking by me for six months! https://t.co/xQFrHtGNJT https://t.co/m2iE1bShdp
lisadaniels3,"FOLLOW MY SEXY RIGHT NOW 
@yin_samurai 
@yin_samurai 

@yin_samurai

@yin_samurai

@yin_samurai https://t.co/Eeb5TE26Zp"
lisadaniels3,"FOLLOW MY SEXY RIGHT NOW 
@yin_samurai 
@yin_samurai 

@yin_samurai

@yin_samurai

@yin_samurai https://t.co/6uzdHTWOIR"
lisadaniels3,"FOLLOW MY SEXY RIGHT NOW 
@yin_samurai 
@yin_samurai 

@yin_samurai

@yin_samurai

@yin_samurai https://t.co/9Dh27SqjPh"
lisadaniels3,Come on! Subscribe to my super exclusive content on my personal FanCentro profile https://t.co/5kdtmantQp! You won'... https://t.co/r8ClvUWVEv
lisadaniels3,"Six months is a long time, and that's how long one loyal fan has been following me -- thanks so much!... https://t.co/vum997caw0"
lisadaniels3,Get exciting updates every day on https://t.co/3ucgLcwSwk! https://t.co/dCpLw4wXeq
lisadaniels3,Wow! I have a really loyal subscriber at https://t.co/mfpKXUT6yI -- they've stayed with me for 6 months. I really ap... https://t.co/RlvWox0wOV
lisadaniels3,"OMG, there's something INCREDIBLE on my FanCentro Feed! All new! Find it here https://t.co/e6J8ah6vZ0. https://t.co/Lm3vlGpjVS"
lisadaniels3,"IM SO GOOD AT GIVING A GOOD JERK OFF INSTRUCTION ON BBC DILDO 

IF YOUR A NE... https://t.co/JzFrDhmkmy"
lisadaniels3,I work hard so my fans will stick around. Big thanks to one loyal fan who's been following https://t.co/ZR2K5sGc55... https://t.co/fOFb9pMG3r
lisadaniels3,A subscriber just rebilled on https://t.co/bWWgI49fGw! Love their loyalty! https://t.co/w8SA2qn1Eh
lisadaniels3,"IN THE BACK OF MY UBER DRIVER CAR PLAYING WITH MY PUSSY  

IF YOUR A NEW ME... https://t.co/JzFrDhmkmy"
lisadaniels3,"Eat, sleep, and scroll! My new post is up at https://t.co/YYcEJe5Qcc. https://t.co/ILW040tvN0"
lisadaniels3," IT'S OFFICIALLY MY BIRTHDAY AND THIS IS WHERE YOU CAN FIND ME TODAY, AT THE... https://t.co/JzFrDhmkmy"
lisadaniels3," IT'S OFFICIALLY MY BIRTHDAY AND THIS IS WHERE YOU CAN FIND ME TODAY, AT THE BAR   

Photoshoot... https://t.co/7qWlhFtdJG"
lisadaniels3,Curious about my profile? Subscribe at https://t.co/hXNufKK7Bh! https://t.co/JPaTw4Y6QZ
lisadaniels3,Thank you babe   https://t.co/JPcIkgRVbZ
lisadaniels3,I got a rebill on my profile https://t.co/wiq6NTDdVR from an awesome fan! https://t.co/aOylNsN4yY
lisadaniels3,"BIRTHDAY DISCOUNT  https://t.co/ecfvColeCN 
ONLY AVAILABLE 4 24 HRS &amp; THE FIRST 50 SUBS. 70% DISCOUNT HURRY B4 IT... https://t.co/Xz5UFacctU"
lisadaniels3,"BIRTHDAY DISCOUNT  https://t.co/ecfvColeCN 
ONLY AVAILABLE 4 24 HRS &amp; THE FIRST 50 SUBS. 70% DISCOUNT HURRY B4 IT... https://t.co/SqcPPmp6WI"
lisadaniels3,"
BIRTHDAY DISCOUNT 
ONLY AVAILABLE 4 24 HRS &amp; THE FIRST 50 SUBS. 70% DISCOUNT HURRY B4 ITS GONE 
SUB NOW &amp; GET A... https://t.co/tNRvXW3vBw"
lisadaniels3,"FUN ROAD TRIP PLAYING WITH MY PUSSY 

IF U WOULD LIKE TO SEE FULL VIDEO DM ME... https://t.co/JzFrDhmkmy"
lisadaniels3,Curious about my profile? Subscribe at https://t.co/hXNufKK7Bh! https://t.co/6GX09FF6Jf
lisadaniels3,My followers are in luck! There's a brand new post on my FanCentro Feed... check it out here... https://t.co/FbfdS79glX
lisadaniels3,Sweet! I just got a rebill from a subscriber on my profile https://t.co/OXOStST9LL! https://t.co/NQlRX3d8hY
lisadaniels3,Tips are the best! I just got one on https://t.co/2y0bNSlfdi. Thanks! https://t.co/KAbu8CyvQS
lisadaniels3,Getting a rebill makes me smile! Just got one on my personal profile https://t.co/U0lnD6RkzU :) https://t.co/J2eJr7Ntg0
lisadaniels3,"Eat, sleep, and scroll! My new post is up at https://t.co/YYcEJe5Qcc. https://t.co/jplUQoxEeC"
lisadaniels3,When a fan stays with https://t.co/8y8prN23zO for six months I know I'm doing something right! Thanks for your loya... https://t.co/bwcZdQJITp
lisadaniels3,Check out my FanCentro Feed -- I just posted something new! https://t.co/Q50ULIHw3v. https://t.co/6mNSMpovEt
lisadaniels3,OMG He was my first agent  when i first got in industry in 2005.. His agency was like something you only see in the... https://t.co/qqyHcgGMUD
lisadaniels3,"I'M LIVE NOW FOR AN EARLY BIRTHDAY CELEBRATION  CAN'T WAIT TO HAVE SOME FUN WITH MY WHIP CREAM.  

I WILL BE... https://t.co/Nm5cnTfgjy"
lisadaniels3,Need a pick-me-up? Come check out the new post on my FanCentro Feed at https://t.co/oIK4kR3fnn. https://t.co/rjrUPJrJfn
lisadaniels3,"JOIN ME  LIVE TODAY ON HERE TO  CELEBRATE MY BIRTHDAY  

I WILL BE LIVE AT... https://t.co/JzFrDhmkmy"
lisadaniels3,LMFAO  https://t.co/QQYx8sOgkA
lisadaniels3,"JOIN ME ON MY MAIN PAGE TO CELEBRATE AN EARLY BIRTHDAY  CAN'T WAIT TO HAVE SOME FUN WITH MY WHIP CREAM.  

I... https://t.co/pqN04FzJNm"
lisadaniels3,"JOIN ME ON MY MAIN PAGE TO CELEBRATE AN EARLY BIRTHDAY  CAN'T WAIT TO HAVE SOME FUN WITH MY WHIP CREAM.  

I... https://t.co/CZHqmH0Myp"
lisadaniels3,"JOIN ME ON MY MAIN PAGE TO CELEBRATE AN EARLY BIRTHDAY  CAN'T WAIT TO HAVE SOME FUN WITH MY WHIP CREAM.  

I... https://t.co/LqofAhm5Ok"
lisadaniels3,What makes me smile? Loyal fans! One faithful fan has been by my side for 6 months at https://t.co/rAFFgCBjWG. Than... https://t.co/aag8y3Q1YX
lisadaniels3,"JOIN ME LIVE THIS THURSDAY 8/27 ON MY MAIN PAGE FOR AN EARLY BIRTHDAY CELEBRATION  

I WILL BE LIVE AT 5 PM P... https://t.co/rgOzL5L8R1"
lisadaniels3,"JOIN ME LIVE THIS THURSDAY 8/27 ON MY MAIN PAGE FOR AN EARLY BIRTHDAY CELEBRATION  

I WILL BE LIVE AT 5 PM P... https://t.co/j3zGYCCKmC"
lisadaniels3,"JOIN ME LIVE THIS THURSDAY 8/27 ON MY MAIN PAGE FOR AN EARLY BIRTHDAY CELEBRATION  

I WILL BE LIVE AT 5 PM P... https://t.co/gTD0NdkrXj"
lisadaniels3,SINCE MY BIRTHDAY IS IN ABOUT 1 WEEK I THOUGHT I WOULD POST UP ONE OF MY EARLY B... https://t.co/JzFrDhmkmy
lisadaniels3,"My FanCentro Feed is full of awesome, exclusive content. I just posted something new, so don't miss out!... https://t.co/gQ4UoNtz9D"
lisadaniels3,Guess what! I just added a new post to my FanCentro feed at https://t.co/tagBicKA4V. Come see it now! https://t.co/KosTpmCV3s
lisadaniels3,I'm waiting for you to subscribe to my personal FanCentro profile at https://t.co/0ye1Mu2xKI. https://t.co/TOIGzTbfzE
lisadaniels3,"My FanCentro Feed is awesome! I just added a new post, check it out at https://t.co/xwr9sREzSF. https://t.co/UuxVBnWwo2"
lisadaniels3,Be the first to know about my new content! Subscribe to my FanCentro profile https://t.co/0sBSZfeATX. https://t.co/BLQIoK6LPj
lisadaniels3,"GOING LIVE NOW, CUM PLAY WITH ME  https://t.co/JzFrDhmkmy"
lisadaniels3,Do you subscribe to my FanCentro Feed? You're in for a treat! Go to https://t.co/jaiLMFiGvL to see what's new. https://t.co/NjhbAlaZbE
lisadaniels3,@Uber_Support check your inbox
lisadaniels3,I got a rebill on my profile https://t.co/Vw3GiA0LXD! You're the best! https://t.co/wkf1rljGrf
lisadaniels3,Do you want access to my most exclusive content? Subscribe to my FanCentro profile here at https://t.co/OiWJwKqwnF https://t.co/S1jIOykCpf
lisadaniels3," BRAND NEW VIDEO

I HELPED HIM OUT WITH HIS HARD ON,  WAIT FOR THE END TO SE... https://t.co/JzFrDhmkmy"
lisadaniels3,I'm all about my fans -- subscribe and check me out at https://t.co/f4HGyhVVTp. You'll be glad you did! https://t.co/HMOagKblYN
lisadaniels3,Love loyal fans! One of my awesome subscribers has been with me for 6 months at https://t.co/gsDD2ciEe0. Thanks for... https://t.co/qZxVPmptL8
lisadaniels3,"NEW VIDEO COMING REAL SOON
https://t.co/Hp1v2XyFYX
https://t.co/Hp1v2XyFYX 
https://t.co/Hp1v2XyFYX https://t.co/ntRElob481"
lisadaniels3,Hey! I can't wait to share all my awesome content with you! Subscribe today at https://t.co/NNrPhwPg9H and get to k... https://t.co/jJbZoEQQjx
lisadaniels3,Celebrating six months of loyalty from one follower today! Thanks for your support! https://t.co/tkksv8Wzf9 https://t.co/fnzyHOFzfI
lisadaniels3,Wanna see some awesome content? Subscribe to my FanCentro profile! https://t.co/InjC4qxdyU! https://t.co/zE8yoOV3Ib
lisadaniels3,SUBSCRIBE TO MY FREE ONLY FANS PAGE https://t.co/Ao9oeCBcRI https://t.co/J4lym1giAB
lisadaniels3,SUBSCRIBE TO MY FREE ONLY FANS PAGE https://t.co/Ao9oeCBcRI https://t.co/H7V03pJLAX
lisadaniels3,"I love my fans, so subscribe at https://t.co/yaPe3igiGs to find out what I have to offer! https://t.co/ELp1l7wFFW"
lisadaniels3,One fan just put a big smile on my face -- they've been loyal to https://t.co/Ls3XFJlf8l for six months! Thank you! https://t.co/yxB7pBJbJy
lisadaniels3,"HELPING HIM WITH HIS MORNING WOOD   GO WATCH IT NOW 
 https://t.co/Hp1v2XyFYX 
 https://t.co/Hp1v2XyFYX 
... https://t.co/luUI152v9h"
lisadaniels3,HELPING HIM WITH HIS MORNING WOOD   ... https://t.co/JzFrDhDVe6
lisadaniels3,I'm all about my fans -- subscribe and check me out at https://t.co/f4HGyhVVTp. You'll be glad you did! https://t.co/kAbGLHTKwI
lisadaniels3,When a fan stays with https://t.co/8y8prNjEYo for six months I know I'm doing something right! Thanks for your loya... https://t.co/lhOuhHUpXv
lisadaniels3,FUCKING MY FACE LIKE A BAD LITTLE SLUT AND TITTY FUCKING  ... https://t.co/JzFrDhmkmy
lisadaniels3,Check out Lisa Daniels's video! #TikTok  https://t.co/AxY7ncGy11
lisadaniels3,HIS COCK SLIPS IN MY PUSSY AND I LOVED IT  ... https://t.co/JzFrDhmkmy
lisadaniels3,That feeling when you have a loyal fan who's subscribed for six months in a row &lt;3 https://t.co/k7eJEG0rCe https://t.co/yQRZnQMwmj
lisadaniels3,I LOVE IT  WHEN HE  CALLS  ME A WHORE WHILE HIS DICK SLIDES IN MY LITTLE FUCK HO... https://t.co/JzFrDhmkmy
lisadaniels3,"A brand new subscriber just joined my personal FanCentro profile https://t.co/pYjn7fO4Ks. Come on, all the cool kid... https://t.co/tojUOEcNmH"
lisadaniels3,I love new fans -- subscribe to my personal FanCentro profile https://t.co/Q4CDSrTZxE and say hello. https://t.co/Kkjfj9Sdvx
lisadaniels3,Sweet! I just got a rebill from a subscriber on my profile https://t.co/OXOStTaKDj! https://t.co/n854UbVvNq
lisadaniels3,YOU could be my newest subscriber at https://t.co/ycjMd5OolT! I'm waiting to say hello. https://t.co/qI4HpJWfmf
lisadaniels3,EVEN AFTER HE CAME ALL OVER MY FACE I STILL CONTINUED TO SUCK HIS COCK     ... https://t.co/JzFrDhDVe6
lisadaniels3,A new fan joined my profile https://t.co/FRrI4XhKb1. Will you be next? ;) https://t.co/QrZ6GeExar
lisadaniels3,Enjoy my private content at https://t.co/wMu4Qs1XKY. You won't be sorry -- subscribe now! https://t.co/cGbR9zZDVz
lisadaniels3,When a fan stays with https://t.co/8y8prN23zO for six months I know I'm doing something right! Thanks for your loya... https://t.co/iR3S5U4iFa
lisadaniels3,Another rebill on my personal profile https://t.co/PQZXewj1ZI by a loyal fan! ;) https://t.co/4tX8iTTwqb
lisadaniels3,Come see what all the fuss is about! Subscribe to my personal FanCentro profile https://t.co/EYZqdonvZY https://t.co/cuwEiurV0v
lisadaniels3,HE  ASKED ME  WHERE HE CAN CUM AND I SAID YOU CAN CUM ON MY SPECTACULAR TITTIES.... https://t.co/JzFrDhmkmy
lisadaniels3,Yay! My profile https://t.co/BIMpr837hZ has a new subscriber. https://t.co/dCC5kKCS15
lisadaniels3,"HERE I AGO AGAIN THE QUEEN AT SUCKING COCK WATCH ME SWALLOW THAT CUM 

IF U... https://t.co/JzFrDhmkmy"
lisadaniels3,I love new fans -- subscribe to my personal FanCentro profile https://t.co/Q4CDSrTZxE and say hello. https://t.co/6AHUb90jrF
lisadaniels3,"GETTING FUCKED DOGGY STYLE, CLOSE UPS AND CAME ON MY ASS 

if ur a new memb... https://t.co/JzFrDhmkmy"
lisadaniels3,Love having new subscribers join my personal profile https://t.co/gcaKIMv28o. I got a new one just now! https://t.co/EFQ5dLmxxh
lisadaniels3,Enjoy my private content at https://t.co/wMu4Qsjz9y. You won't be sorry -- subscribe now! https://t.co/Ci5tyH26m5
lisadaniels3,A loyal fan joined my profile https://t.co/v7iXovqwdy today. Only REAL fans do! ;) https://t.co/9RHKy4rv3g
lisadaniels3,"IM GOING LIVE ON MY WEBSITE  THIS EVENING AT 5 PM PST CUM HAVE SOME FUN WITH ME 
https://t.co/Hp1v2XyFYX... https://t.co/V7JVjRpJJV"
lisadaniels3,"GIVING HIM A BLOWJOB UNDER THE TABLE WHILE HE WATCHES PORN  FROM HIS PHONE 
GO WATCH FULL VIDEO ON MY WEBSITE N... https://t.co/JLatOzNoZN"
lisadaniels3,Be the first to know about my new content! Subscribe to my FanCentro profile https://t.co/0sBSZfeATX. https://t.co/LufzUiSSXc
lisadaniels3,GIVING HIM A BLOWJOB UNDER THE TABLE WHILE HE WATCHES PORN ON HIS PHONE ... https://t.co/JzFrDhmkmy
lisadaniels3,YOU could be my newest subscriber at https://t.co/ycjMd5OolT! I'm waiting to say hello. https://t.co/ScvRqUose5
lisadaniels3,Six months? HIGH-FIVE! Thanks to my loyal fan for sticking by my side on https://t.co/tpqsfs5hgi https://t.co/XwYZM32VDp
lisadaniels3,My profile https://t.co/RX8e2re9RP tells me that I got another rebill just now! Yay! https://t.co/6reAEyWCDl
lisadaniels3,Be the first to know about my new content! Subscribe to my FanCentro profile https://t.co/0sBSZfeATX. https://t.co/nm6C4x3vLo
lisadaniels3,I work hard so my fans will stick around. Big thanks to one loyal fan who's been following https://t.co/ZR2K5sGc55... https://t.co/bKy0B8fHZ0
lisadaniels3,Have you visited my profile https://t.co/B2JIa1ZZcB? I just got a new subscriber! https://t.co/f6VNmFiLwr
lisadaniels3,"LIVE NOW LIVE NOW  STOP MISSING OUT ON NEWEST AND HOTTEST VIDEO, GO ADD ME ON MY WEBSITE: 
... https://t.co/IvYm1mlmXA"
lisadaniels3,I love to see my fans at https://t.co/Vt78k9vNHW! Treat yourself and subscribe today! https://t.co/ktvvREb4on
lisadaniels3,Longtime fans are the best! Thanks to the loyal follower who's been with me for six months! https://t.co/P5eDZ5uMqK https://t.co/JMwQN7VPMS
lisadaniels3,"MY PUSSY JUICE ALL OVER HIS COCK 

IF YOUR A NEW MEMBER AND WOULD LIKE TO... https://t.co/JzFrDhmkmy"
lisadaniels3,My premium subscriptions are so much fun! Subscribe at my FanCentro profile https://t.co/CRcTqkJTqf to be a part of... https://t.co/WmgmbylVFR
lisadaniels3," NEW VIDEO  NEW VIDEO 
BRAND NEW VIDEO COMING THIS FRIDAY. NEVER SEEN BEFORE  DON'T MISS IT HURRY GO ADD ME ON M... https://t.co/NSos807nWw"
lisadaniels3,I work hard so my fans will stick around. Big thanks to one loyal fan who's been following https://t.co/ZR2K5sGc55... https://t.co/s8SuXA8Inn
lisadaniels3,I love you mama I can't wait for another pool day @NikkiDelano   https://t.co/MIwNnFzFpe
lisadaniels3,I love making my fans happy! I've got one who's been loyal to https://t.co/cO6jNuI2wD for six months. Thank you :) https://t.co/BUkhPbFOVa
lisadaniels3,LIVE NOW https://t.co/Q6XYFLnCzQ https://t.co/CYJ5Is8vDN
lisadaniels3,Get exciting updates every day on https://t.co/3ucgLcwSwk! https://t.co/ikV0yWqdCq
lisadaniels3,My premium subscriptions are so much fun! Subscribe at my FanCentro profile https://t.co/CRcTqkJTqf to be a part of... https://t.co/lqZjIbqQNM
lisadaniels3,FanCentro fans are incredible! I've got one who's been following me for six months -- thanks for your support!... https://t.co/FqqIrM89Rl
lisadaniels3,"LIVE NOW  !! LIVE NOW !!
https://t.co/Hp1v2XyFYX

https://t.co/Hp1v2XyFYX

https://t.co/Hp1v2XyFYX https://t.co/i2bfGuGLAQ"
lisadaniels3,A subscriber on my personal profile https://t.co/K1OTDFmyHw rebilled just now! &lt;3 https://t.co/GeavoffBlg
lisadaniels3,"FUCK MY FACE AND FUCK MY FUCK HOLE 

IF YOUR A NEW MEMBER &amp; WOULD LIKE TO... https://t.co/JzFrDhmkmy"
lisadaniels3,Celebrating six months of loyalty from one follower today! Thanks for your support! https://t.co/tkksv8Wzf9 https://t.co/YYIvqFilwQ
lisadaniels3,"LIVE NOW ON 
https://t.co/Hp1v2XyFYX 

https://t.co/Hp1v2XyFYX

https://t.co/Hp1v2XyFYX https://t.co/pI38wcPetB"
lisadaniels3,"LIVE NOWLIVE NOW 
WATCH FULL VIDEO NOW ON MY MAIN FAN PAGE 
https://t.co/Hp1v2XyFYX... https://t.co/UM2PEsi426"
lisadaniels3, https://t.co/THZGS5PAKj
lisadaniels3,Super hot  pictures.   https://t.co/02dycfqtYC
lisadaniels3,"IM THE  QUEEN OF SUCKING COCK , WATCH THIS 8 MIN + VIDEO OF ME DEVOURING THIS JUICY COCK 

ONLY ON MY FANS PAGE... https://t.co/yiqI6nEoYa"
lisadaniels3,IM THE QUEEN OF SUCKING COCK   WATCH THIS 8 MIN + VIDEO OF ME DEVOURING THI... https://t.co/JzFrDhmkmy
lisadaniels3,Love my incredible fans! Today I'm saying thanks to one special fan who has been following https://t.co/xibwm7gY9F... https://t.co/dqgEWAZbuf
lisadaniels3,"ADD ME NOW ON MY !!FREE !!FANS PAGE  
https://t.co/h3Zpxe1aoN
https://t.co/h3Zpxe1aoN... https://t.co/E9NHZ6Pkn2"
lisadaniels3,"RT @LisaAndVanessa: #SundayFunday #Lesbian 

 @lisadaniels3 
 @MissCelesteStar 
  Lacie Heart 

#SexyWomen #GirlsonGirls #GirlsKi..."
lisadaniels3,My private photos and videos are here -- subscribe at my FanCentro profile https://t.co/ddqHXF0vpG! https://t.co/kbNO7nNpaJ
lisadaniels3,Celebrating six months of loyalty from one follower today! Thanks for your support! https://t.co/tkksv8Wzf9 https://t.co/rxEcYvkLfe
lisadaniels3,"5 MINUTES + OF JUST FUCKING MY ASSHOLE  

IF YOUR A NEW MEMBER &amp; WOULD... https://t.co/JzFrDhmkmy"
lisadaniels3,#NewProfilePic https://t.co/2sXzk39MkL
lisadaniels3,"TAKE A DIP IN MY POOL VIDEO COMING SOON 
ADD ME ON MY ONLY FANS &amp; UPGRADE TO NO LOCK VIDEOS. AFTER YOU SUBSCRIB... https://t.co/iMeIRnsRQe"
lisadaniels3,ADD ME ON MY ONLY FANS &amp; UPGRADE TO NO LOCK VIDEOS. AFTER YOU SUBSCRIBE TEXT ME  THIS EMOJI  FOR INFO ON UPGRADING... https://t.co/NnUeQLCHaq
lisadaniels3,Longtime fans are the best! Thanks to the loyal follower who's been with me for six months! https://t.co/P5eDZ5uMqK https://t.co/3a8Vxc2uvS
lisadaniels3,CHECK THIS OUT LOVES. https://t.co/u6HPeSDLFx
lisadaniels3,"GOOD LITTLE SLUTS GET CREAM PIES  

IF YOUR A NEW MEMBER &amp; WOULD LIKE TO S... https://t.co/JzFrDhmkmy"
lisadaniels3,FanCentro fans are incredible! I've got one who's been following me for six months -- thanks for your support!... https://t.co/jscs8bmkap
lisadaniels3,"LICKING THE DIRECTORS BALLS. AND LETTING HIM HAVE HIS WAY WITH ME 

IF YOU... https://t.co/JzFrDhmkmy"
lisadaniels3,Enjoy my private content at https://t.co/wMu4Qsjz9y. You won't be sorry -- subscribe now! https://t.co/8mnSHuFJuv
lisadaniels3,Huge shoutout to the loyal fan who's been subscribed to https://t.co/wIhHE6apuw for six months!!! https://t.co/4yJGRJtKwk
lisadaniels3,"NEW VIDEO COMING SOON 

NEVER EVER SEEN VIDEO BEFORE 

TO GUARANTEE THAT YOU... https://t.co/JzFrDhmkmy"
lisadaniels3,I have lots of fun on https://t.co/Cohy3aIyP3! Subscribe to see what I'm up to! https://t.co/ogj7xqepKD
lisadaniels3,One fan just put a big smile on my face -- they've been loyal to https://t.co/Ls3XFJlf8l for six months! Thank you! https://t.co/LvatFxeDja
lisadaniels3,"New video never ever seen before coming soon. 
https://t.co/Hp1v2XyFYX

https://t.co/Hp1v2XyFYX... https://t.co/ydRhJwvATr"
lisadaniels3,"NEW VIDEO COMING SOON 

NEVER EVER SEEN VIDEO BEFORE 

TO GUARANTEE THAT YOU... https://t.co/JzFrDhmkmy"
lisadaniels3,AREN'T LOCKED VIDEOS GETTING EXPENSIVE? DON'T U WANT THE FREEDOM 2 JERK OFF  W/OUT WORRYING ABOUT SPENDING MORE ... https://t.co/s4EKmFlOGU
lisadaniels3,AREN'T LOCKED VIDEOS GETTING EXPENSIVE? DON'T U WANT THE FREEDOM 2 JERK OFF  W/OUT WORRYING ABOUT SPENDING MORE ... https://t.co/E8VDzArQXZ
lisadaniels3,AREN'T LOCKED VIDEOS GETTING EXPENSIVE? DON'T U WANT THE FREEDOM 2 JERK OFF  W/OUT WORRYING ABOUT SPENDING MORE ... https://t.co/XYomoqnWzg
lisadaniels3,AREN'T LOCKED VIDEOS GETTING EXPENSIVE? DON'T U WANT THE FREEDOM 2 JERK OFF  W/OUT WORRYING ABOUT SPENDING MORE ... https://t.co/DZDpTAmEy3
lisadaniels3,Wow! I have a really loyal subscriber at https://t.co/mfpKXUT6yI -- they've stayed with me for 6 months. I really ap... https://t.co/5Ta1zAx6qk
lisadaniels3,"JERK OFF INSTRUCTIONS WILL HAVE YOU CUMMING BEFORE ITS OVER 

IF YOUR A NEW... https://t.co/JzFrDhmkmy"
lisadaniels3,My personal profile https://t.co/WewYaHy30Q just got another subscriber rebilling. Love it! https://t.co/td0Z2oQI8K
lisadaniels3,Someone is FAN enough! My profile https://t.co/mEU0CD14I4 has a loyal six month follower! https://t.co/Ez8ukTz32S
lisadaniels3,"YOU GOTTA SEE HOW CREAMY MY PUSSY GOT,  

$28 #10 https://t.co/JzFrDhmkmy"
lisadaniels3,An awesome fan just rebilled on my profile https://t.co/9SDAwZJwst! Who else wants to stay? https://t.co/5zQGgScV05
lisadaniels3,I work hard so my fans will stick around. Big thanks to one loyal fan who's been following https://t.co/ZR2K5sGc55... https://t.co/jWWctfSdqh
lisadaniels3,"IN THE BACK OF THE UBERS DRIVERS CAR PLAYING WITH MY PUSSY 

IF A NEW MEMBER &amp;... https://t.co/JzFrDhmkmy"
lisadaniels3,"RT @LisaAndVanessa: #SexySaturday #Lesbian 

 @lisadaniels3  
  Crissy Moran 
  Holly Morgan 
  Teana Kai 
  Angel Cassidy ..."
