username,text
lisadaniels3,"Oh I didn't know that, thank you for that info  https://t.co/gWSepLJCE1"
lisadaniels3,I know I shouldn't be making this a big deal but I have an appointment to get my first vaccination and I'm so nervous   
lisadaniels3,"FREEFREEFREEFREE

https://t.co/DjHiXHDxN7"
lisadaniels3,"FREEFREEFREEFREE

https://t.co/DjHiXHDxN7"
lisadaniels3,"FREEFREEFREEFREE

https://t.co/DjHiXHDxN7"
lisadaniels3,"RT @AboutVirgos: Being mutable, #Virgos are: Easy to get along with, can easily adapt, love variety, go with the flow &amp; can talk their way..."
lisadaniels3,"TAKING ORDERS RIGHT NOW
GET A PAIR OF PANTIES WITH MY NATURAL PUSSY AROMA AND... https://t.co/JzFrDhmkmy"
lisadaniels3,Hey guys! Big thanks today to a loyal fan who has followed me at https://t.co/31HdgGY6rI for six months! https://t.co/P1teT44OVY
lisadaniels3,"I love my fans, and I want to connect with you -- subscribe at https://t.co/z5aOLWWrf5! https://t.co/Sz56VcOETL"
lisadaniels3,Love my incredible fans! Today I'm saying thanks to one special fan who has been following https://t.co/xibwm7gY9F... https://t.co/fSRfSihNuF
lisadaniels3,Someone on my profile https://t.co/kAVQzU1jkp just rebilled...how awesome is that? https://t.co/DLmrh84V6t
lisadaniels3,I love getting new subscribers to https://t.co/6os2L0v1ki. Lucky me--I got another one today! https://t.co/CAKw95msIl
lisadaniels3,Are you ready to have fun? Subscribe at https://t.co/pKyje655jE! https://t.co/oo6hXUzoIp
lisadaniels3,Love loyal fans! One of my awesome subscribers has been with me for 6 months at https://t.co/gsDD2ciEe0. Thanks for... https://t.co/WMQcYaFk8I
lisadaniels3,Wanna see some awesome content? Subscribe to my FanCentro profile! https://t.co/InjC4qxdyU! https://t.co/nu4wdzfb8P
lisadaniels3,Love my incredible fans! Today I'm saying thanks to one special fan who has been following https://t.co/xibwm7gY9F... https://t.co/6G7jEpY2eb
lisadaniels3,A lovely someone rebilled on my personal profile https://t.co/RW4YX7le2P. (happy sigh) https://t.co/xheFIUJeCj
lisadaniels3,Are you ready to have fun? Subscribe at https://t.co/pKyje655jE! https://t.co/07N5oLNgR2
lisadaniels3,One fan just put a big smile on my face -- they've been loyal to https://t.co/Ls3XFJlf8l for six months! Thank you! https://t.co/ahtZcz5yb3
lisadaniels3,"RT @lisadaniels3: GIVING YOU 3 MONTHS FOR FREE FOR MY MAIN PAGE LINK ON MY BIO    

https://t.co/DjHiXHDxN7 https://t.co/aNAbMt..."
lisadaniels3,MAKE SURE TO GO WITH MY GIRL A HAPPY BIRTHDAY  @babyjxo21 https://t.co/UkB6RHTpRz
lisadaniels3,RT @babyjxo21: Surprise!!! my birthday is tomorrow!!!  Come wish me a happy birthday below  https://t.co/dSqzLnSfog
lisadaniels3,Hey! My super exclusive content is waiting for you at https://t.co/tln4l17kCL. Subscribe today! https://t.co/FKNFDGCUeA
lisadaniels3,My girl from school has her onlyfans set up and is celebrating her birthday  please go wish her a happy birthday a... https://t.co/lEIYVM7ALR
lisadaniels3,@babyjxo21 My girl from school has her onlyfans set up and is celebrating her birthday  please go wish her a happy... https://t.co/qLKIR4DxxG
lisadaniels3,"Six months is a long time, and that's how long one loyal fan has been following me -- thanks so much!... https://t.co/tfTnvBt8jn"
lisadaniels3,"GIVING YOU 3 MONTHS FOR FREE FOR MY MAIN PAGE LINK ON MY BIO    

https://t.co/DjHiXHDxN7 https://t.co/aNAbMt5YSX"
lisadaniels3,"ARE YOU INTERESTED IN PURCHASING A PAIR OF MY USED PANTIES ?????/
GET A PAIR O... https://t.co/JzFrDhmkmy"
lisadaniels3,DM ME IF YOUR READY TO HAVE YOUR BALLS DRAINED  https://t.co/JzFrDhmkmy
lisadaniels3,"I love my fans, so subscribe at https://t.co/yaPe3igiGs to find out what I have to offer! https://t.co/JouNeI0csK"
lisadaniels3,Guess what! I have a subscriber who has stayed with me for 6 months at https://t.co/cCJBeaZITs. Thanks for the loya... https://t.co/2dcMqL5nvb
lisadaniels3,"You just found your lucky charm, and it's better than a pot of gold. 3 month FREE access to  Main page only Ava... https://t.co/SKS4LXq4TZ"
lisadaniels3,I love to see my fans at https://t.co/Vt78k9vNHW! Treat yourself and subscribe today! https://t.co/InLqZIDIwX
lisadaniels3,I work hard so my fans will stick around. Big thanks to one loyal fan who's been following https://t.co/ZR2K5sGc55... https://t.co/bblukBbNmw
lisadaniels3,Get exciting updates every day on https://t.co/3ucgLcwSwk! https://t.co/XNuWSM6uhK
lisadaniels3,I've got the best fans! One loyal supporter has been with https://t.co/4z15xHyuzF for 6 months! Thank you! https://t.co/6eiUf6QRwN
lisadaniels3,#NewProfilePic https://t.co/FPpphuuNeV
lisadaniels3,Enjoy my private content at https://t.co/wMu4Qsjz9y. You won't be sorry -- subscribe now! https://t.co/lNNJmcY9o6
lisadaniels3,I've got the best fans! One loyal supporter has been with https://t.co/4z15xHyuzF for 6 months! Thank you! https://t.co/76jXBZ5dc7
lisadaniels3,Are you ready to have fun? Subscribe at https://t.co/pKyje655jE! https://t.co/Sae7kR5EPI
lisadaniels3,&lt;Waving&gt; Hey loyal fan! Thanks for sticking by me for six months! https://t.co/xQFrHtGNJT https://t.co/9ErHxZB055
lisadaniels3," GET 3 FREE MONTHS
 GET A FREE VIDEO 

LINK ON BIO      https://t.co/WrR1f1Rc6S"
lisadaniels3,"Follow my sexy girlfriend. She just created her first  only fan's page, go check her out and let me know if I shoul... https://t.co/q3woDznaRJ"
lisadaniels3,Do you want access to my most exclusive content? Subscribe to my FanCentro profile here at https://t.co/OiWJwKqwnF https://t.co/a68mk40USA
lisadaniels3,Celebrating six months of loyalty from one follower today! Thanks for your support! https://t.co/tkksv8Wzf9 https://t.co/BzyTLuN5kQ
lisadaniels3,I'm all about my fans -- subscribe and check me out at https://t.co/f4HGyhVVTp. You'll be glad you did! https://t.co/0TcBdDDTcA
lisadaniels3,"Six months is a long time, and that's how long one loyal fan has been following me -- thanks so much!... https://t.co/m7f5JLjI4N"
lisadaniels3,My personal FanCentro profile https://t.co/yt2AOi4atn has a lot to offer. Come see it now! https://t.co/6uJJI5ted2
lisadaniels3,3 FREE MONTHS + FREE GIFT  FOR MY MAIN PAGE HURRY  LINK ON BIO https://t.co/pWE4G1aE7N
lisadaniels3,3 FREE MONTHS + FREE GIFT  FOR MY MAIN PAGE HURRY  LINK ON BIO https://t.co/s0QniUXt9o
lisadaniels3,Wanna see some awesome content? Subscribe to my FanCentro profile! https://t.co/InjC4qxdyU! https://t.co/ekletZAk7q
lisadaniels3,Another awesome subscriber just rebilled on https://t.co/VWhZLyoV36. I can't wait to show you what's next! https://t.co/UoWT8WHckJ
lisadaniels3,Subscribe to follow me and my adventures on my personal profile https://t.co/j9UMRaSl3l! https://t.co/Qui0M3cAWn
lisadaniels3,Why am I smiling? Because I've got a loyal fan who's been following https://t.co/YyFuzHBwCc for six months. Thanks... https://t.co/5W1r4XXOu4
lisadaniels3,My profile https://t.co/7VCie8BdeM has a new subscriber who can now enjoy exclusive stuff! https://t.co/8fw9MaU2jG
lisadaniels3,It was here in simi 3.2 earthquake @NinaElleXoXo https://t.co/OvcVdIbml0
lisadaniels3,I think so I just felt that @NinaElleXoXo https://t.co/VmouEIEMOi
lisadaniels3,YOU could be my newest subscriber at https://t.co/ycjMd5OolT! I'm waiting to say hello. https://t.co/KfjPuLKtVh
lisadaniels3,"When my fans are happy, so am I -- I'd like to thank the loyal fan who has been with me for six months :)... https://t.co/GD8ltmRdCt"
lisadaniels3,Another rebill on my personal profile https://t.co/PQZXewj1ZI by a loyal fan! ;) https://t.co/FT5lUaBIHF
lisadaniels3,"FREE FREE FREE
FREE VIDEO + FREE ACCESS
link on my bio      "
lisadaniels3,"FREE FREE FREE
FREE VIDEO + FREE ACCESS
link on my bio      "
lisadaniels3,"FREE FREE FREE
FREE VIDEO + FREE ACCESS
link on my bio      "
lisadaniels3,"FREE FREE FREE
FREE VIDEO + FREE ACCESS
link on my bio      "
lisadaniels3,"RT @lisadaniels3: FREE FREE FREE
FREE VIDEO + FREE ACCESS
link on my bio      "
lisadaniels3,"RT @lisadaniels3: FREE FREE FREE
FREE VIDEO + FREE ACCESS
link on my bio      "
lisadaniels3,"RT @lisadaniels3: FREE FREE FREE
FREE VIDEO + FREE ACCESS
link on my bio      "
lisadaniels3,I'm all about my fans -- subscribe and check me out at https://t.co/f4HGyhVVTp. You'll be glad you did! https://t.co/WaIL8k5e2P
lisadaniels3,"RT @lisadaniels3: FREE FREE FREE
FREE VIDEO + FREE ACCESS
link on my bio      "
lisadaniels3,"RT @LisaAndVanessa: #TittyTuesday #Lesbian 

 @lisadaniels3 
  Tiffany Taylor 

#SexyWomen #GirlsonGirls #GirlsKissingGirls #GirlsW..."
lisadaniels3,"FREE FREE FREE
FREE VIDEO + FREE ACCESS
link on my bio      "
lisadaniels3,"FREE FREE FREE
FREE VIDEO + FREE ACCESS
link on my bio      "
lisadaniels3,"FREE FREE FREE
FREE VIDEO + FREE ACCESS
link on my bio      "
lisadaniels3,"FREE FREE FREE
FREE VIDEO + FREE ACCESS
link on my bio      "
lisadaniels3,I've got the best fans! One loyal supporter has been with https://t.co/4z15xHyuzF for 6 months! Thank you! https://t.co/jYsOZOkQ6E
lisadaniels3,"FREE FREE FREE
FREE VIDEO + FREE ACCESS
link on my bio      "
lisadaniels3,I love to see my fans at https://t.co/Vt78k9vNHW! Treat yourself and subscribe today! https://t.co/ALmcw2oCvY
lisadaniels3,"GET 1 FREE MONTH  ACCESS 
GET 1 FREE SEX VIDEO
GET FREE TRIAL LINK ON MY BIO NOW         https://t.co/YfnYXdHPi6"
lisadaniels3,"WHICH HOLE DO YOU WANT
TO FUCK FIRST ??
GET A FREE MONTH WHEN YOU SUBSCRIBE TO MY MAIN PAGE, FREE TRIAL LINK ON MY BIO   "
lisadaniels3,Come on! Subscribe to my super exclusive content on my personal FanCentro profile https://t.co/5kdtmantQp! You won'... https://t.co/Dc5j5VMzOt
lisadaniels3,Shop today @juicysinsonline  and get discount  https://t.co/ct2FF2zvL8
lisadaniels3,"OFFER AVAILABLE ONLY FOR TODAY
Get these 4 videos today+
6 more when you upgrade 
Slide into my dm on my main 
Page... https://t.co/hhTEjgQw2A"
lisadaniels3,HURRY    LINK ON BIO https://t.co/3KAErB3Ptv
lisadaniels3,I'm all about my fans -- subscribe and check me out at https://t.co/f4HGyhVVTp. You'll be glad you did! https://t.co/OzIWue7GSi
lisadaniels3,My fans make me so happy! I've got one who's stood by my side for six months on https://t.co/CcfaTPJOPp. Thanks a m... https://t.co/yyxalGL1nX
lisadaniels3,LINK ON BIO        https://t.co/sXsUYmNWMu
lisadaniels3,RT @lisadaniels3: I'M FEELING HORNY TODAY CAN YOU TELL....  GO TO MY LINK ON MY BIO RIGHT NOW TO GET FULL FREE ACCESS TO MY MAIN PAGE AND...
lisadaniels3,I'M FEELING HORNY TODAY CAN YOU TELL....  GO TO MY LINK ON MY BIO RIGHT NOW TO GET FULL FREE ACCESS TO MY MAIN PAG... https://t.co/9TtHkm3MZQ
lisadaniels3,I love new fans -- subscribe to my personal FanCentro profile https://t.co/Q4CDSrTZxE and say hello. https://t.co/gXrnXCV3Ts
lisadaniels3,That feeling when you have a loyal fan who's subscribed for six months in a row &lt;3 https://t.co/k7eJEG0rCe https://t.co/8b1I2Jhfyl
lisadaniels3,Someone on my profile https://t.co/kAVQzU1jkp just rebilled...how awesome is that? https://t.co/HI3YTNGwky
lisadaniels3,Do you want access to my most exclusive content? Subscribe to my FanCentro profile here at https://t.co/OiWJwKqwnF https://t.co/yX4FNFyQf1
lisadaniels3,I love making my fans happy! I've got one who's been loyal to https://t.co/cO6jNuI2wD for six months. Thank you :) https://t.co/AtxEUMa5cq
lisadaniels3,Subscribe to follow me and my adventures on my personal profile https://t.co/j9UMRaSl3l! https://t.co/pBsXdgL65A
lisadaniels3,I love making my fans happy! I've got one who's been loyal to https://t.co/cO6jNuI2wD for six months. Thank you :) https://t.co/iCZT2avgw4
lisadaniels3,"VALENTINES DAY GIFT FROM ME TO YOU
 LINK ON BIO  https://t.co/FYLLs4LBqM"
lisadaniels3,THANK YOU #HUSTLERMAGAZINE  &amp; #LARRYFLYNT @ImLarryFlynt @Hustler for all that  opportunities and memories RIP   https://t.co/6C4kWcnScG
lisadaniels3,"FULL HUSTLER MAGAZINE SPREAD 
THANK YOU #HUSTLERMAGAZINE  &amp; #LARRYFLYNT @ImL... https://t.co/JzFrDhmkmy"
lisadaniels3,THANK YOU #HUSTLERMAGAZINE  &amp; #LARRYFLYNT @ImLarryFlynt @Hustler for all one opportunities and memories RIP   https://t.co/9CffNdmktU
lisadaniels3,"RIP #LARRYFLINT @ImLarryFlynt THANK YOU FOR ALL THE OPPORTUNITIES YOU GAVE ME ALONG WITH SO MANY OTHER MODELS, AND... https://t.co/DTdBERIIBY"
lisadaniels3,Do you want access to my most exclusive content? Subscribe to my FanCentro profile here at https://t.co/OiWJwKqwnF https://t.co/GAMdeMcRGj
lisadaniels3,"Have you subscribed to my main page???? 
https://t.co/ecfvCoCPul https://t.co/6nPjYmuCmU"
lisadaniels3,I love new fans -- subscribe to my personal FanCentro profile https://t.co/Q4CDSrTZxE and say hello. https://t.co/vE5ggrcpWh
lisadaniels3,"Guess what, guys? One loyal fan has been following https://t.co/v82J03JYue for six months... is it you??? https://t.co/oIvebT1oJZ"
lisadaniels3,"NEW VIDEO
 Fucking some random
Guy in the gym bathroom 
Without a condom

 F... https://t.co/JzFrDhmkmy"
lisadaniels3,Check out my profile -- I know you'll want to stay! https://t.co/EqPOHi0pxl https://t.co/niHAmOCvIQ
lisadaniels3,https://t.co/Hp1v2XyFYX  https://t.co/OsFth7qoAI
lisadaniels3,That feeling when you have a loyal fan who's subscribed for six months in a row &lt;3 https://t.co/k7eJEG0rCe https://t.co/iPfa2wmdOm
lisadaniels3,"Im a horny little slut and looking for a good fuck
HERE IS A  FREE Trial TO MY MAIN PAGE  

https://t.co/jnWd54UBt9"
lisadaniels3,"WOULD YOU DATE ME ????
SLIDE INTO MY MAIN PAGE DM NOW https://t.co/Hp1v2XyFYX  https://t.co/QebSJdR8vb"
lisadaniels3,"DON'T MISS OUT ON TONIGHTS  CONTENT https://t.co/Hp1v2XyFYX 
 https://t.co/uJspktp8lm"
lisadaniels3,My private photos and videos are here -- subscribe at my FanCentro profile https://t.co/ddqHXF0vpG! https://t.co/6JiFpshkFZ
lisadaniels3,"this is why you
Should be watching
My blowjob videos &amp; watch
The Blowjob que... https://t.co/JzFrDhmkmy"
lisadaniels3,Why am I smiling? Because I've got a loyal fan who's been following https://t.co/YyFuzHBwCc for six months. Thanks... https://t.co/JmVl4h7ggJ
lisadaniels3,"The power of prayers

 Please say a little prayer for mama M that her results come back benign  https://t.co/RbQtcIVSuV"
lisadaniels3,Awe babe I'm so sorry  @alanaevansxxx https://t.co/Cw0XgGmuOp
lisadaniels3,My personal FanCentro profile https://t.co/yt2AOi4atn has a lot to offer. Come see it now! https://t.co/erp7SHcBx4
lisadaniels3,My fans are the greatest! I've got one who's been following me for 6 months at https://t.co/JTkJcxhVhp. Thanks a bu... https://t.co/S45Cu5b4rh
lisadaniels3,"GET MORE BANG FOR YOUR BUCK 
Get 10 full hardcore Uncensored unlocked video's... https://t.co/JzFrDhmkmy"
lisadaniels3,#NewProfilePic https://t.co/DxQcdiivRo
lisadaniels3,Get exciting updates every day on https://t.co/3ucgLcwSwk! https://t.co/7bBiiKaZMI
lisadaniels3," SUB NOW &amp; GET FREE SEX VIDEO
 EXTRA OPTION 2 UPGRADE 2 NO LOCKED VIDEOS  &amp; GET 3 FREE VIDEOS PLUS UNLOCKED VIDE... https://t.co/4u11zPqVKl"
lisadaniels3,"Weekend special
 Free offer to subscribe to my page hurry Before all the free spots are taken TAP here 

https://t.co/ZJMboRk75e"
lisadaniels3,One fan just put a big smile on my face -- they've been loyal to https://t.co/Ls3XFJlf8l for six months! Thank you! https://t.co/1SnpgVyjd7
lisadaniels3,"NEW VIDEO COMING TODAY ON MY MAIN PAGE  sloppy blowjob 
https://t.co/ecfvCoCPul https://t.co/amgMSDSG6a"
lisadaniels3,"Have you added me on my main page yet????
https://t.co/Hp1v2XyFYX https://t.co/7urkfJhD0o"
lisadaniels3,"What are you waiting for... go claim your free  
https://t.co/VO5izaah5e https://t.co/wWXgBwR3QY"
lisadaniels3,One of my loyal fans rebilled on my profile https://t.co/4ZX6E72WeW! Thanks! https://t.co/GWdZ6dkHsD
lisadaniels3,I'm waiting for you to subscribe to my personal FanCentro profile at https://t.co/0ye1Mu2xKI. https://t.co/h2C4CFQCUN
lisadaniels3,That feeling when you have a loyal fan who's subscribed for six months in a row &lt;3 https://t.co/k7eJEG0rCe https://t.co/XuHuRwDiOO
lisadaniels3,Are you ready to have your balls drained  https://t.co/Hp1v2XyFYX https://t.co/W4FaoHqPby
lisadaniels3,FREE GIFT https://t.co/Hp1v2XyFYX https://t.co/jomOCAnGrk
lisadaniels3,Do you want access to my most exclusive content? Subscribe to my FanCentro profile here at https://t.co/OiWJwKqwnF https://t.co/V6laAVbmVR
lisadaniels3,A subscriber rebilled on my profile https://t.co/Bj3eku6DtP -- Glad you're enjoying my profile! https://t.co/RicfOzjn5t
lisadaniels3,Huge shoutout to the loyal fan who's been subscribed to https://t.co/wIhHE6apuw for six months!!! https://t.co/GACYZb5DmO
lisadaniels3,Another awesome subscriber just rebilled on https://t.co/VWhZLyoV36. I can't wait to show you what's next! https://t.co/owrkGvapNC
lisadaniels3,Are you ready to have fun? Subscribe at https://t.co/pKyje655jE! https://t.co/PkQHxLocvZ
lisadaniels3,"YOU GUYS ARE ALWAYS ASKING FOR COCK RATINGS, SO MAKE SURE TO TAKE THIS OPPORTUNI... https://t.co/JzFrDhmkmy"
lisadaniels3,DOING COCK RATING NOW ON MY MAIN PAGE GO SUBSCRIBE NOW FOR FREE . LINK ON BIO   https://t.co/DljAFAJWV4
lisadaniels3,"new inventory
@juicysinsonline is offering 30% off on all items including this beautiful piece you won't believe t... https://t.co/Hg8nVFiNcr"
lisadaniels3,Need a new way to pass the time? Subscribe to https://t.co/GH9pxWpMk3. I bet I can help! https://t.co/rGTO5DGnXN
lisadaniels3,"SUCKING OFF TRAINER IN THE GYM BATHROOM 
ADD ME NOW ON MY MAIN PAGE, LINK ON BIO   
https://t.co/Hp1v2XyFYX https://t.co/rPsTr5anWy"
lisadaniels3,"GO WATCH THESE 2 VIDEOS NOW ON MY MAIN PAGE 
The first 50 people to add me on my main page get in for FREE  LINK O... https://t.co/Hn7ICPQpuV"
lisadaniels3,"RT @lisadaniels3: NEW FREE TRIAL OFFER
Only for the first 50 get free access https://t.co/9JLdqV1O4L"
lisadaniels3,I love to see my fans at https://t.co/Vt78k9vNHW! Treat yourself and subscribe today! https://t.co/dXP9trSO7F
lisadaniels3,"NEW FREE TRIAL OFFER
Only for the first 50 get free access https://t.co/9JLdqV1O4L"
lisadaniels3,"CHECK YOUR DM FOR THIS  HOT CREAMY PUSSY  VIDEO I JUST SENT YOU 

After unloc... https://t.co/JzFrDhmkmy"
lisadaniels3,Are you ready to have fun? Subscribe at https://t.co/pKyje655jE! https://t.co/I6StXDNwJH
lisadaniels3,When a fan stays with https://t.co/8y8prNjEYo for six months I know I'm doing something right! Thanks for your loya... https://t.co/OwS38kr7F8
lisadaniels3,"CAN I DRAIN YOUR BALLS DADDY  
I'M WAITING FOR YOU RIGHT NOW TO DRAIN THEM 

https://t.co/ecfvColeCN... https://t.co/SmJwiPZlus"
lisadaniels3,FREE TRIAL OFFER FOR A MONTH TO THE FIRST 50 PEOPLE TO CLICK LINK ON MY BIO  OR CLICK THIS LINK ... https://t.co/RxS1Bf4xdL
lisadaniels3,"First your going to get down on your knees and then your going to taste me 
C... https://t.co/JzFrDhmkmy"
lisadaniels3,Hey! My super exclusive content is waiting for you at https://t.co/tln4l17kCL. Subscribe today! https://t.co/dQ1K1mVaU7
lisadaniels3,"FREEFREE FREE 
 TRIAL OFFER FOR A MONTH TO THE FIRST 50 PEOPLE TO CLICK LINK ON MY BIO OR CLICK HERE ... https://t.co/V4D9A58k79"
lisadaniels3,An awesome fan just rebilled on my profile https://t.co/9SDAwZJwst! Who else wants to stay? https://t.co/c4QgKxuIY1
lisadaniels3,NEED HELP CUMMING??? DM ME NOW  https://t.co/JzFrDhmkmy
lisadaniels3,Be the first to know about my new content! Subscribe to my FanCentro profile https://t.co/0sBSZfeATX. https://t.co/JRUql4YwIx
lisadaniels3,I love making my fans happy! I've got one who's been loyal to https://t.co/cO6jNuZDob for six months. Thank you :) https://t.co/pGm6pKaM6D
lisadaniels3,"GETTING FUCKED DOGGY, REVERSE COWGIRL AND GETTING CREAMPIED  GO WATCH NOW ON MY MAIN PAGE... https://t.co/hJywxqdTuR"
lisadaniels3,Hey! My super exclusive content is waiting for you at https://t.co/tln4l1oVuj. Subscribe today! https://t.co/9TwoYCqFyJ
lisadaniels3,"Guess what, guys? One loyal fan has been following https://t.co/v82J03JYue for six months... is it you??? https://t.co/CsuPOh8EVV"
lisadaniels3,OMG! Got another subscriber to my profile https://t.co/Tx99bD6AKI just now! https://t.co/i1o4GkrAHs
lisadaniels3,My private photos and videos are here -- subscribe at my FanCentro profile https://t.co/ddqHXF0vpG! https://t.co/aME0m0Sddp
lisadaniels3,Hey! My super exclusive content is waiting for you at https://t.co/tln4l17kCL. Subscribe today! https://t.co/tPbaklPpDr
lisadaniels3,My private photos and videos are here -- subscribe at my FanCentro profile https://t.co/ddqHXF0vpG! https://t.co/PyLnjDZYOz
lisadaniels3,When a fan stays with https://t.co/8y8prNjEYo for six months I know I'm doing something right! Thanks for your loya... https://t.co/RMRRfvizs2
lisadaniels3,Psst...subscribe now at https://t.co/EcBYZdfELY so I can share my content with you! https://t.co/8DNiTdxMa9
lisadaniels3,"Six months is a long time, and that's how long one loyal fan has been following me -- thanks so much!... https://t.co/ilV9rFdGrb"
lisadaniels3,Wanna see some awesome content? Subscribe to my FanCentro profile! https://t.co/InjC4qxdyU! https://t.co/WstqtFNUvm
lisadaniels3,One fan just put a big smile on my face -- they've been loyal to https://t.co/Ls3XFJlf8l for six months! Thank you! https://t.co/NTgLsRY4Ug
lisadaniels3,"LAST CHANCE TO GET MY MAIN PAGE FOR 60% OFF 
HURRY GO       
https://t.co/Hp1v2XyFYX... https://t.co/pueVN4UZ0W"
lisadaniels3,"RT @lisadaniels3: 60% OFF FOR MY MAIN PAGE TILL THE JANUARY 1st HURRY BABE, BL BEFORE RATES GO BACK UP  
https://t.co/Hp1v2XyFYX
https://..."
lisadaniels3,Sweet! I just got a rebill from a subscriber on my profile https://t.co/OXOStST9LL! https://t.co/AiWe9LNumW
lisadaniels3,I WATCHED IT WHILE I WAS IN COLOMBIA AND NOW IT'S HERE IN THE USA GO WATCH THE JENNI RIVERA TELENOVELA ON NETFLIX I... https://t.co/jscCwAcEuZ
lisadaniels3," HAPPY NEW YEAR
MAKE SURE TO WATCH FULL VIDEO TO SEE IF YOU WON A GIFT C... https://t.co/JzFrDhmkmy"
lisadaniels3,Get exciting updates every day on https://t.co/3ucgLcwSwk! https://t.co/1UlAnsZVFc
lisadaniels3,My fans make me so happy! I've got one who's stood by my side for six months on https://t.co/CcfaTPJOPp. Thanks a m... https://t.co/tkfiKfXEGG
lisadaniels3,"60% OFF FOR MY MAIN PAGE TILL THE JANUARY 1st HURRY BABE, BL BEFORE RATES GO BACK UP  
https://t.co/Hp1v2XyFYX... https://t.co/I4LAxCLopZ"
lisadaniels3,Your baby will thank you for this  https://t.co/I6TMMA0Dum https://t.co/jFdqxLp3Qk
lisadaniels3,A subscriber just rebilled on https://t.co/oyVrWmq0i7! Thanks for the love! https://t.co/GfCT6OO0zx
lisadaniels3,Your baby will thank you for this  https://t.co/I6TMMA0Dum https://t.co/h82SEPhq6y
lisadaniels3,Your baby will thank you for this  https://t.co/I6TMMA0Dum https://t.co/1u8MkvGxyQ
lisadaniels3,Guess what! I have a subscriber who has stayed with me for 6 months at https://t.co/cCJBeaZITs. Thanks for the loya... https://t.co/5zjKkXWiXb
lisadaniels3,This is amazing! Someone just rebilled on my profile https://t.co/Y0Mx8FwUSs! https://t.co/8n43ytU67O
lisadaniels3,FanCentro fans are incredible! I've got one who's been following me for six months -- thanks for your support!... https://t.co/l1RYMDjyp6
lisadaniels3,"DOING A RAFFLE NOW TO WIN THESE GIFT CARDS, NOW ON MY MAIN PAGE https://t.co/ecfvCoCPul
https://t.co/ecfvCoCPul https://t.co/YB4nS3WQYj"
lisadaniels3,"DOES ANYONE HAVE ANY GOOD JOKE ????    
Here's mine:
I asked god when I die c... https://t.co/JzFrDhmkmy"
lisadaniels3,Subscribe to follow me and my adventures on my personal profile https://t.co/j9UMRaSl3l! https://t.co/dS6bnNTeD0
lisadaniels3, @juicysinsonline https://t.co/QiRWv02SMR
lisadaniels3,How many Other creators are spoiling you like this for Christmas  https://t.co/JzFrDhmkmy
lisadaniels3,Subscribe to follow me and my adventures on my personal profile https://t.co/j9UMRaSl3l! https://t.co/Cic8OPndXx
lisadaniels3,I've got the best fans! One loyal supporter has been with https://t.co/4z15xHyuzF for 6 months! Thank you! https://t.co/kHsyGz3InI
lisadaniels3,@juicysinsonline offering 40% off entire site biggest sale ever hurry before the year is over... https://t.co/TC2JbHDj0j
lisadaniels3,Love it! My profile https://t.co/aC08N7RX68 had 100 views in a single day! https://t.co/CAjshZ13Iv
lisadaniels3,I'm all about my fans -- subscribe and check me out at https://t.co/f4HGyhVVTp. You'll be glad you did! https://t.co/TEVNYDOdzw
lisadaniels3,Woohoo! I've got a loyal subscriber here https://t.co/a2dcWa2GZP! Six months strong! https://t.co/bqCaoeusAC
lisadaniels3,"STOP REQUESTING TO ADD YOU ON MY VIP TWITTER   
YOU NEED TO SUBSCRIBE BEFORE YOU CAN GET ADDED. GO... https://t.co/v6a5QzmUY7"
lisadaniels3,"STOP REQUESTING TO ADD YOU ON MY VIP TWITTER   
YOU NEED TO SUBSCRIBE BEFORE YOU CAN GET ADDED. GO... https://t.co/93MmBSKYiF"
lisadaniels3,"STOP REQUESTING TO ADD YOU ON MY VIP TWITTER   
YOU NEED TO SUBSCRIBE BEFORE YOU CAN GET ADDED. GO T... https://t.co/okAQJG5Iox"
lisadaniels3,"STOP REQUESTING TO ADD YOU ON MY VIP TWITTER   
YOU NEED TO SUBSCRIBE BEFORE YOU CAN GET ADDED. GO T... https://t.co/upw1qL9QQd"
lisadaniels3,"STOP REQUESTING TO ADD YOU ON MY VIP TWITTER   
YOU NEED TO SUBSCRIBE BEFORE YOU CAN GET ADDED. GO TO... https://t.co/czA714yaDQ"
lisadaniels3,I SEE YOU GUYS TRYING TO GET ADDED TO MY VIP TWITTER BUT YOU NEED TO SUBSCRIBE HERE FIRST https://t.co/TfZBOYNW4H UNDER FLEETS
lisadaniels3,Subscribe to see me at https://t.co/1jxGUAzyGC. I know you'll want to stay. https://t.co/aXItmF8SJe
lisadaniels3,@lisadanielsvip hello
lisadaniels3,Huge shoutout to the loyal fan who's been subscribed to https://t.co/wIhHE6apuw for six months!!! https://t.co/sk6ekZtOkt
lisadaniels3, I'M DEBATING ON IF I SHOULD START A PAID TWITTER VIP PAGE WHERE I POST MY  XXX CONTENT I HAVE MY ONLY FANS ALREA... https://t.co/QUCO0XEy3M
lisadaniels3,Article out now https://t.co/xqttC43Dau #bbl #surgery #cosmeticsurgery #colombia https://t.co/l9eAqHZsqQ
lisadaniels3,@BreeOlson  I just followed you on ig follow me back 
lisadaniels3,"Omg , babe where have you been?? It's so nice to you on my timeline  @BreeOlson https://t.co/bbS6jEafGO"
lisadaniels3," HOLIDAY GIVEAWAY GOODY BAG 

MY MAIN PAGE IS 60% OFF RIGHT NOW + GET THE HOLIDAY GIVEAWAY ... https://t.co/UtY9gXhNKP"
