username,text
lisadaniels3,My fans make me so happy! I've got one who's stood by my side for six months on https://t.co/CcfaTPJOPp. Thanks a m... https://t.co/qXoDCwIcSm
lisadaniels3,HAD A PEEPING TOM WATCHING ME SHOWER  https://t.co/JzFrDhmkmy
lisadaniels3,I'm so horny i can't stop thinking about your Dick penetrating my wet pussy   https://t.co/ecfvCoCPul https://t.co/3WV7ibBI6o
lisadaniels3,Your dinner is served  https://t.co/ecfvCoCPul https://t.co/zaK62Pg3IZ
lisadaniels3,CUM PLAY PAPI https://t.co/ecfvCoCPul  https://t.co/yzskhg2VSt
lisadaniels3,"I GOT SO HORNY IN THE CAR, THAT I STARTED FINGER BANGING MY LITTLE PUSSY ... https://t.co/JzFrDhmkmy"
lisadaniels3,Hey guys! Big thanks today to a loyal fan who has followed me at https://t.co/31HdgGY6rI for six months! https://t.co/qJ0dRzOwfA
lisadaniels3,HE ASKED ME WHAT MY FAVORITE SEX POSITION IS AND I SAID LET ME SHOW U ... https://t.co/JzFrDhmkmy
lisadaniels3,Guess what! I have a subscriber who has stayed with me for 6 months at https://t.co/z65v1a6bir. Thanks for the loya... https://t.co/qXs0XIUQC8
lisadaniels3,"MY RELAXING BATH  TURNED INTO A  FACIAL  

IF A NEW MEMBER &amp; WOULD LIKE... https://t.co/JzFrDhmkmy"
lisadaniels3,What makes me smile? Loyal fans! One faithful fan has been by my side for 6 months at https://t.co/z65v1a6bir. Than... https://t.co/H4GZIZhY84
lisadaniels3,"TELL ME HOW MUCH YOU LOVE MY TITTIES, CUM WORSHIP THEM 

#41 https://t.co/JzFrDhmkmy"
lisadaniels3,Why am I smiling? Because I've got a loyal fan who's been following https://t.co/z65v1a6bir for six months. Thanks... https://t.co/SGYhPLykyY
lisadaniels3,"GETTING A NICE FAT FACIAL IN THE SHOWER 

IF A NEW MEMBER &amp; WOULD LIKE... https://t.co/JzFrDhmkmy"
lisadaniels3,My profile https://t.co/z65v1a6bir got another rebill just moments ago. Waiting on the next one ;) https://t.co/hD2MXWujwb
lisadaniels3,ROAD TRIP.  I DON'T CARE WHERE I'M. AT IF I'M FEELING HORNY I WILL JUST PULL MY... https://t.co/JzFrDhmkmy
lisadaniels3,Subscribe to see me at https://t.co/z65v1a6bir. I know you'll want to stay. https://t.co/frc6rhuK3x
lisadaniels3,Celebrating six months of loyalty from one follower today! Thanks for your support! https://t.co/z65v1a6bir https://t.co/Ms6BLx4wVK
lisadaniels3,https://t.co/ecfvCoCPul https://t.co/ecfvCoCPul https://t.co/ecfvCoCPul https://t.co/ecfvCoCPul... https://t.co/xh1RV5AwXL
lisadaniels3,I got a rebill on my profile https://t.co/z65v1a6bir from an awesome fan! https://t.co/lWaP6PXWlm
lisadaniels3,My private photos and videos are here -- subscribe at my FanCentro profile https://t.co/z65v1a6bir! https://t.co/gdIzVAZx7e
lisadaniels3,My fans make me so happy! I've got one who's stood by my side for six months on https://t.co/z65v1a6bir. Thanks a m... https://t.co/AFAH1TprV6
lisadaniels3,Be the first to know about my new content! Subscribe to my FanCentro profile https://t.co/z65v19OzTR. https://t.co/9l5IYheaty
lisadaniels3,Huge shoutout to the loyal fan who's been subscribed to https://t.co/z65v1a6bir for six months!!! https://t.co/0uFUICKKWx
lisadaniels3,"RIDING THAT DILDO SO GOOD,  SEE HOW CREAMY MY PUSSY GOT   https://t.co/JzFrDhmkmy"
lisadaniels3,I have lots of fun on https://t.co/z65v1a6bir! Subscribe to see what I'm up to! https://t.co/zuSj6DRDhw
lisadaniels3,"GOOD MORNING,  TODAY I TRAVEL BACK HOME TO LOS ANGELES. https://t.co/JzFrDhmkmy"
lisadaniels3,Longtime fans are the best! Thanks to the loyal follower who's been with me for six months! https://t.co/z65v1a6bir https://t.co/tAnZ0xxOLG
lisadaniels3,TONIGHT I WILL BE GOING LIVE FROM THE NEXT HAUNTED LOCATION  ONLY ON MY FANS PAGE  https://t.co/ecfvColeCN DON'T M... https://t.co/GfJPPpJJGv
lisadaniels3,RT @lisadaniels3: I WILL BE GOING LIVE TOMORROW ON MY MAIN ONLY FANS FROM PRESIDIO LA BAHIA THAT IS KNOWN TO BE HAUNTED. IF YOU AREN'T FAMI...
lisadaniels3,Subscribe to follow me and my adventures on my personal profile https://t.co/z65v1a6bir! https://t.co/r8sBxaSLm6
lisadaniels3,"Guess what, guys? One loyal fan has been following https://t.co/z65v1a6bir for six months... is it you??? https://t.co/9Qz338KAMh"
lisadaniels3,I WILL BE GOING LIVE TOMORROW ON MY MAIN ONLY FANS FROM PRESIDIO LA BAHIA THAT IS KNOWN TO BE HAUNTED. IF YOU AREN'... https://t.co/3azXiq8oVZ
lisadaniels3,I WILL BE GOING LIVE TOMORROW ON MY ONLY FANS FROM PRESIDIO LA BAHIA.  IF YOU AREN'T FAMILIAR CHECK OUT THE WIKIPED... https://t.co/AHIBS1NnHL
lisadaniels3,"FINGER FUCKING MY PUSSY TILL I EXPLODED EVERYWHERE  
#squirt 

#51 $... https://t.co/JzFrDhmkmy"
lisadaniels3,Check out my profile -- I know you'll want to stay! https://t.co/z65v1a6bir https://t.co/2J6wScvZuk
lisadaniels3,Hey guys! Big thanks today to a loyal fan who has followed me at https://t.co/z65v1a6bir for six months! https://t.co/tOGW4UbiMP
lisadaniels3,"LEAVING COLOMBIA WITH A BANG ,AND A MOUTH FULL OF CUM   THAT I SWALLOWED  https://t.co/JzFrDhmkmy"
lisadaniels3,Longtime fans are the best! Thanks to the loyal follower who's been with me for six months! https://t.co/z65v1a6bir https://t.co/SsxBzX8Xdq
lisadaniels3,"NEW NEW NEW 
https://t.co/ecfvColeCN https://t.co/XaQOAv6fnR"
lisadaniels3,"NEW NEW NEW 
https://t.co/ecfvColeCN https://t.co/kher7GREed"
lisadaniels3,"NEW NEW NEW 
https://t.co/ecfvColeCN https://t.co/zaWD6ZPWhR"
lisadaniels3,"NEW NEW NEW 
https://t.co/ecfvColeCN https://t.co/oqxmgaTLgA"
lisadaniels3,I'M GOING TO MISS COLOMBIA SO MUCH THIS IS A BITTER SWEET GOOD BYE.  https://t.co/JzFrDhmkmy
lisadaniels3,This is amazing! Someone just rebilled on my profile https://t.co/z65v19OzTR! https://t.co/OvW7ebjAt0
lisadaniels3,Someone just rebilled on my personal profile https://t.co/z65v1a6bir! Can't wait to show them new content! https://t.co/Yl97EDpEFy
lisadaniels3,"IF YOU AIN'T NASTY, DON'T CLICK THE 
L I N K ON MY B I O  https://t.co/ecfvColeCN https://t.co/tgKKS5S7Fv"
lisadaniels3,Check out my profile -- I know you'll want to stay! https://t.co/z65v1a6bir https://t.co/MY6N4PLwFT
lisadaniels3,Why am I smiling? Because I've got a loyal fan who's been following https://t.co/z65v1a6bir for six months. Thanks... https://t.co/nZPTsbhKsn
lisadaniels3,"HE TOLD ME TO TAKE THAT COCK  

#60 $16.99 https://t.co/JzFrDhmkmy"
lisadaniels3,GIVING HIM THE BEST FOOT JOB OF HIS LIFE . I LOVE WHEN I FEEL THAT CUM SLIDDING... https://t.co/JzFrDhmkmy
lisadaniels3,"Dios mio, muchas gracias, gracias a Dios.  Entonces, ?cuanto tiempo tengo que usar mi cupon? Creo en el cupon que m... https://t.co/v2cH5oTa24"
lisadaniels3,"hola, lo he intentado y nunca he recibido respuesta, pero tengo curiosidad por saber si el bono que me enviaron tod... https://t.co/mffJEYqqRQ"
lisadaniels3,"@Avianca hola, lo he intentado y nunca he recibido respuesta, pero tengo curiosidad por saber si el bono que me env... https://t.co/pZxhjPpfxt"
lisadaniels3,"HEY GUYS, PLEASE FOLLOW MY PUBLIC &amp; NEW AND ONLY SC ACCOUNT.  MY OTHER ONE GOT DELETED. THANK YOU  ... https://t.co/4IN4aTliOE"
lisadaniels3,"I love my fans, and I want to connect with you -- subscribe at https://t.co/z65v1a6bir! https://t.co/NzwMkeQkGz"
lisadaniels3,"My week on Twitter : 28 Mentions, 388K Mention Reach, 238 Likes, 48 Retweets, 25K Retweet Reach. See yours with... https://t.co/zazR2lfx3M"
lisadaniels3,"Our biggest fans this week: BDBOK3, MaryJaneXXX, wlarch. Thank you! via https://t.co/5tJtldjzJP https://t.co/IHvx09kwwd"
lisadaniels3,I work hard so my fans will stick around. Big thanks to one loyal fan who's been following https://t.co/z65v1a6bir... https://t.co/0Ky4N3JhqI
lisadaniels3,A new fan joined my profile https://t.co/z65v1a6bir. Will you be next? ;) https://t.co/4ygELMIK9j
lisadaniels3,"Our biggest fans this week: MAdm2019, chriswilson235, Deadpool_promos. Thank you! via https://t.co/5tJtldjzJP https://t.co/YELiSzIS7o"
lisadaniels3,"My week on Twitter : 39 Mentions, 452K Mention Reach, 485 Likes, 65 Retweets, 20.7K Retweet Reach. See yours with... https://t.co/GRMWN4eP9V"
lisadaniels3,I LOVE YOU WATCHING ME WALK AWAY  https://t.co/JzFrDhmkmy
lisadaniels3,"WATCH THE BLOWJOB QUEEN  WORK THAT COCK 

JUST SENT YOU FULL VIDEO TO YOUR I... https://t.co/JzFrDhmkmy"
lisadaniels3,YES!! I just got a tip at https://t.co/z65v1a6bir. Thanks! https://t.co/Ob8byLp5HP
lisadaniels3,"GIVE ME A FACIAL WITH YOUR CUM BABY 

#61 $14.99 https://t.co/JzFrDhmkmy"
lisadaniels3,"YAAAAY!! Somebody just tipped me at https://t.co/z65v1a6bir. Thanks a lot, hon! https://t.co/zZ1Bjlsj9U"
lisadaniels3,It's always a good day when a new subscriber joins my profile https://t.co/z65v1a6bir :) https://t.co/tGKlTzJAlX
lisadaniels3,WOW! I just got a tip on https://t.co/z65v1a6bir. https://t.co/neBLEtdVb2
lisadaniels3,I have 2 more drainage massages left. And these aren't the nice relaxing massage... https://t.co/JzFrDhmkmy
lisadaniels3,"CAN I BORROW YOUR DICK TO SIT ON IT???   

#13 $11.99 https://t.co/JzFrDhmkmy"
lisadaniels3,"My week on Twitter : 40 Mentions, 413K Mention Reach, 1.03K Likes, 73 Retweets, 650K Retweet Reach. See yours with... https://t.co/OmuLbgMnlu"
lisadaniels3,I love it! My profile https://t.co/z65v1a6bir just got a new subscriber! https://t.co/M0JNmIbeQv
lisadaniels3, WORKING MY LITTLE FUCK HOLE FOR YOU DADDY  https://t.co/JzFrDhmkmy
lisadaniels3, https://t.co/yVXZsWRzpA
lisadaniels3,"My week on Twitter : 23 Mentions, 430K Mention Reach, 348 Likes, 36 Retweets, 8.57K Retweet Reach. See yours with... https://t.co/R5Qahq2yzH"
lisadaniels3,"Our biggest fans this week: DaisyMiller232, MiaClarke719, wlarch. Thank you! via https://t.co/5tJtldjzJP https://t.co/oUTL3bPpbY"
lisadaniels3,"NEW NEW 
His balls started to fill up so I emptied them immediately in my Mouth and swallowed my dinner Under the... https://t.co/wEgqFvADat"
lisadaniels3,When a fan stays with https://t.co/z65v1a6bir for six months I know I'm doing something right! Thanks for your loya... https://t.co/7UgLRCnL78
lisadaniels3,A subscriber just rebilled on https://t.co/z65v1a6bir! Thanks for the love! https://t.co/ziFOVKCILu
lisadaniels3,"My week on Twitter : 37 Mentions, 390K Mention Reach, 646 Likes, 57 Retweets, 53.7K Retweet Reach. See yours with... https://t.co/93yRCqCycF"
lisadaniels3,"Our biggest fans this week: M6969Xx, MaggieWhite919, AliciaBrown919. Thank you! via https://t.co/5tJtldjzJP https://t.co/4DQ0FW5II7"
lisadaniels3,"STOP TEASING MY DICK HE SAID  AND PUT IT IN YOUR F%@KEN MOUTH,, 

JUST SENT Y... https://t.co/JzFrDhmkmy"
lisadaniels3,WHAT TIMES ARE U USUALLY HERE ON ONLY FANS? LET ME KNOW AROUND WHAT TIME YOUR US... https://t.co/JzFrDhmkmy
lisadaniels3,"I'M SUPER EXCITED I'M GOING BACK TO THE STATES ON MAY 18 ,  I HAVEN'T BEEN A... https://t.co/JzFrDhmkmy"
lisadaniels3,  https://t.co/CXifkp4Ssv
lisadaniels3,Awesome! I got a new rebill on https://t.co/z65v1a6bir! Love my subscribers! https://t.co/Z4vVQeBhgn
lisadaniels3, Hey babe If you are a titty man then your going to love this video. If you wo... https://t.co/JzFrDhmkmy
lisadaniels3,I kept jacking him off after he came and I made him CUM multiple times  ... https://t.co/JzFrDhmkmy
lisadaniels3,Check out Lisa Daniels's video! #TikTok https://t.co/1UOO6UY49i
lisadaniels3,Get exciting updates every day on https://t.co/z65v1a6bir! https://t.co/SV7mgeFDqo
lisadaniels3,Yay! Someone just tipped me at https://t.co/z65v1a6bir. Time to celebrate! https://t.co/l35JumQXig
lisadaniels3,"Your Dick taste so good in my mouth 

JUST SENT YOU FULL VIDEO TO YOUR INBOX... https://t.co/JzFrDhmkmy"
lisadaniels3,"I CAME SO HARD WITH A DICK IN MY PUSSY AND MY MAGIC WAND ON MY CLICK.  

JUST... https://t.co/JzFrDhmkmy"
lisadaniels3,Another subscriber joined my profile https://t.co/z65v1a6bir. Love to see my fanbase grow! https://t.co/A8I9bPws0E
lisadaniels3,I work hard so my fans will stick around. Big thanks to one loyal fan who's been following https://t.co/z65v1a6bir... https://t.co/zLGMKWpuPy
lisadaniels3,Love loyal fans! One of my awesome subscribers has been with me for 6 months at https://t.co/z65v1a6bir. Thanks for... https://t.co/9hjdUfEEQ8
lisadaniels3,metrocuarado https://t.co/mJEUuFocCx via @Metrocuarado
lisadaniels3,Love it! I just got another tip at https://t.co/z65v1a6bir. Thanks a million!!! https://t.co/3FgKAy4RFY
lisadaniels3,RT @dillingerxxx: Spying on Lisa Daniels through 2 Way mirror as she takes selfies https://t.co/K0pWnFqY6I
lisadaniels3,"NEWNEW

You can hear  how happy my PUSSY is with this Dick inside me, so FUC... https://t.co/JzFrDhmkmy"
lisadaniels3,"RT @LisaAndVanessa: #ThrowbackThursday #Lesbian 

 @lisadaniels3 
  Teanna Kai 

#SexyWomen #GirlsonGirls #GirlsKissingGirls #Girls..."
lisadaniels3,"Open your mouth wide and take my squirt  

#25 $15.99 https://t.co/JzFrDhmkmy"
lisadaniels3,Follow @Isabellasfeet https://t.co/XSEggQTu1Q
lisadaniels3,"RT @Victoria_May89: Roses are red, my undies are blue, I need some good dick but dildos will do. https://t.co/igbJeGlnRy"
lisadaniels3,RT @Victoria_May89: When this pandemic is over who should I collab with for an epic threesome? I want to look forward to something naughty!...
lisadaniels3,RT @Victoria_May89: Good morning you sexy fuckers! https://t.co/ma1fbMvYr3
lisadaniels3,"RT @SexyTeacherKaty: Check out my daughter @AdmireMeVIP 
https://t.co/GtoaxPPDN2 
@bambiblacks_uk https://t.co/MjLJLC58ti"
lisadaniels3,"RT @SexyTeacherKaty: Does my bum look big in this? 
@tterb1407 @Fan_Of_Glamour @GreatAssBigTits @Bear1Knuffel https://t.co/JR..."
lisadaniels3,"RT @SexyTeacherKaty: Where are your eyes drawn to first? Lace? Stocking? Tits? Pussy? Drawers in the background? 
#StayHome #..."
lisadaniels3,RT @modelhannahniki: Cum join the fun  RT if you wanna have fun  https://t.co/SVRgzxxtWC
lisadaniels3,"RT @modelhannahniki: Retweet if you want to have some fun 

https://t.co/uv01zhqzef https://t.co/vFi8EnuSiH"
lisadaniels3,RT @modelhannahniki: OMG my FREE #onlyfans page  https://t.co/xKOmAT3Hif  https://t.co/LzVpTEztrO
lisadaniels3,"Finger fucking my wet pussy with 2 fingers 

#25 $10.99 https://t.co/JzFrDhmkmy"
lisadaniels3,Stretching out my Asshole and pussy for you papi   https://t.co/JzFrDhmkmy
lisadaniels3,"Guess what, guys? One loyal fan has been following https://t.co/z65v1a6bir for six months... is it you??? https://t.co/01AswySK0m"
lisadaniels3,Another dare accomplished. In the back seat of my uber playing with my juicy wet... https://t.co/JzFrDhmkmy
lisadaniels3,"I WAS DARED TO GET NAKED AT THE PARK, AND I NEVER PASS UP A DARE  https://t.co/JzFrDhmkmy"
lisadaniels3,"My week on Twitter : 21 Mentions, 327K Mention Reach, 450 Likes, 1 Retweet, 23 Retweet Reach. See yours with... https://t.co/B1fiQFChvi"
lisadaniels3,"NEWNEW 
My little horny male nurse snuck in my room last night and took advant... https://t.co/JzFrDhmkmy"
lisadaniels3,Our biggest fans this week: FaiaWVinograd08. Thank you! via https://t.co/5tJtldjzJP https://t.co/NiJY6qNTBJ
lisadaniels3,"My week on Twitter : 22 Mentions, 438K Mention Reach, 384 Likes, 1 Retweet, 65 Retweet Reach. See yours with... https://t.co/rikAMGRo1f"
lisadaniels3,"He gave it to me hard and good, pounded the shit out of my little PUSSY . Watch... https://t.co/JzFrDhmkmy"
lisadaniels3,"My week on Twitter : 14 Mentions, 380K Mention Reach, 238 Likes, 3 Replies. See yours with https://t.co/iE6i4WPUh4 https://t.co/XcmmXIbI7M"
lisadaniels3,I got  so turned on gliding his cock between my feet and watching it grow and ge... https://t.co/JzFrDhDVe6
lisadaniels3,"My week on Twitter : 8 Mentions, 108K Mention Reach, 504 Likes, 1 Retweet, 55 Retweet Reach. See yours with... https://t.co/Gi5FLo7OUQ"
lisadaniels3,Come on! Subscribe to my super exclusive content on my personal FanCentro profile https://t.co/z65v1a6bir! You won'... https://t.co/asNFLSRPXS
lisadaniels3,Our biggest fans this week: TamaraYKazako53. Thank you! via https://t.co/5tJtldjzJP https://t.co/N1NHRXLAEm
lisadaniels3,Coxo https://t.co/JzFrDhmkmy
lisadaniels3,My fans help me be the best I can be! Today is one fan's six month anniversary following me -- thanks for the love!... https://t.co/viB198uV7t
lisadaniels3,I love getting new subscribers to https://t.co/z65v1a6bir. Lucky me--I got another one today! https://t.co/CLCYVbsYJc
lisadaniels3,My week on Twitter : 579 Likes. See yours with https://t.co/iE6i4WPUh4 https://t.co/NWNsuq5w1H
lisadaniels3,The camera guy got so turned on he used my face as his cum dumpster  #facial... https://t.co/JzFrDhmkmy
lisadaniels3,"My week on Twitter : 713 Likes, 1 Retweet, 137 Retweet Reach. See yours with https://t.co/iE6i4WPUh4 https://t.co/PczQEjrizE"
lisadaniels3,CHECK OUT NEW PAGE: SIBLINGS GIVING AWAY A FREE SEX VIDEO TO THE FIRST 50 TO SUB. ADD RIGHT NOW ... https://t.co/WkeHIbBpIN
lisadaniels3,Our biggest fans this week: ItxNewday. Thank you! via https://t.co/5tJtldjzJP https://t.co/k1GSnvXRZC
lisadaniels3,This is why I'm the blow job queen  &amp; the reason he keeps coming back to th... https://t.co/JzFrDhmkmy
lisadaniels3,"My week on Twitter : 94 Likes, 1 Retweet, 25 Retweet Reach. See yours with https://t.co/iE6i4WPUh4 https://t.co/D8JqiqqF7b"
lisadaniels3,Our biggest fans this week: Liubamedvedev20. Thank you! via https://t.co/5tJtldjzJP https://t.co/tPWmGk6FSn
lisadaniels3,My premium subscriptions are so much fun! Subscribe at my FanCentro profile https://t.co/z65v1a6bir to be a part of... https://t.co/Lxh7FS4HrY
lisadaniels3,"When a subscriber rebills on https://t.co/z65v1a6bir, it puts me in a good mood. I'm in a great mood now :) https://t.co/C9ATLIKjSL"
lisadaniels3,My fans are the greatest! I've got one who's been following me for 6 months at https://t.co/z65v1a6bir. Thanks a bu... https://t.co/q6wOSv1DUO
lisadaniels3,"RT @taboosiblings: GRAND OPENING PAGE DISCOUNT  

GET A FREE WELCOME SEX VIDEO OF ME AND MY STEP-BROTHER WHEN YOU SUBSCRIBE 
https://t...."
lisadaniels3,"My week on Twitter : 1 Mention, 40 Retweets, 69.2K Retweet Reach. See yours with https://t.co/iE6i4WPUh4 https://t.co/Nfa9eTDIzt"
lisadaniels3,"Our biggest fans this week: LisaAndVanessa, KinkyArrow, Retweetrr12345. Thank you! via https://t.co/5tJtldjzJP https://t.co/9UnU0V0MBz"
lisadaniels3,"My week on Twitter : 51 Mentions, 348K Mention Reach, 615 Likes, 51 Retweets, 58.9K Retweet Reach. See yours with... https://t.co/NXwvppZ905"
lisadaniels3,"Our biggest fans this week: CathyfromRSAVS, A_sFaundez, Bambamsnag. Thank you! via https://t.co/5tJtldjzJP https://t.co/DZYFPM81ls"
lisadaniels3,He came on my perfect tits https://t.co/KP7iQ2hYgN https://t.co/MxoR4K2S52
lisadaniels3,Come subscribe to my FanCentro profile https://t.co/z65v1a6bir and say hello! https://t.co/cEIRZdHE66
lisadaniels3,FanCentro fans are incredible! I've got one who's been following me for six months -- thanks for your support!... https://t.co/ZlwRDf6mLg
lisadaniels3,Check out Lisa Daniels's video! #TikTok https://t.co/JM31La61Hn
lisadaniels3,having some fun in the sun with my girls https://t.co/KP7iQ20mSd https://t.co/KmjQ5gAe9B
lisadaniels3,Thanks for rebilling on my profile https://t.co/z65v1a6bir! https://t.co/cr8nPR1svB
lisadaniels3,NEW PAGE  NEW PAGE @taboosiblings @taboosiblings @taboosiblings @taboosiblings https://t.co/4wuOm0dE8I
lisadaniels3,Are you ready to have fun? Subscribe at https://t.co/z65v1a6bir! https://t.co/h6ZXxWGyjx
lisadaniels3,&lt;Waving&gt; Hey loyal fan! Thanks for sticking by me for six months! https://t.co/z65v1a6bir https://t.co/OeGufaURYq
lisadaniels3,YOU could be my newest subscriber at https://t.co/z65v1a6bir! I'm waiting to say hello. https://t.co/0GNDnjFubs
lisadaniels3,FanCentro fans are incredible! I've got one who's been following me for six months -- thanks for your support!... https://t.co/jhiLujr8Ba
lisadaniels3,"I'm going ride your cock just like this, until I make you cum inside my PUSSY ho... https://t.co/JzFrDhmkmy"
lisadaniels3,Subscribe to follow me and my adventures on my personal profile https://t.co/z65v1a6bir! https://t.co/9fAYULYTdQ
lisadaniels3,My fans make me so happy! I've got one who's stood by my side for six months on https://t.co/z65v1a6bir. Thanks a m... https://t.co/rlcm3F7RZU
lisadaniels3,TONIGHT I WILL REVEAL &amp; EXPOSE MY NEW BODY ON MY ONLY FANS  ADD ME TODAY &amp; YOU WILL ALSO GET A FREE   (only new... https://t.co/AJaPoWQgrZ
lisadaniels3,ONE IN MY ASSHOLE  AND ONE IN PUSSY  https://t.co/JzFrDhDVe6
lisadaniels3,@ktronixcolombia hola hice un pedido ayer.todavia no he recibido la confirmacion de entrege. Puedes seguirme para q... https://t.co/0gYWOCSdtd
lisadaniels3,GOT A LITTLE BIT ON MY FEET    AND GOT A LITTLE IN MY PUSSY  https://t.co/JzFrDhmkmy
lisadaniels3,I love to see my fans at https://t.co/z65v1a6bir! Treat yourself and subscribe today! https://t.co/VkXm2Lsr6r
lisadaniels3,New photoset https://t.co/KP7iQ2hYgN https://t.co/RHEB6BnHNk
lisadaniels3,That feeling when you have a loyal fan who's subscribed for six months in a row &lt;3 https://t.co/z65v1a6bir https://t.co/vg5zpJDQ4e
lisadaniels3,RT @lisadaniels3: IT'S OFFICIAL I'M STUCK IN COLOMBIA UNTIL QUARANTINE HAS BEEN LIFTED  2 PASS BOREDOM MEET ME ON MY O.F I WILL BE SPENDI...
lisadaniels3,"IM 8 DAYS POST OP SUREGRY, AND 4 DAYS QUARANTINE, AND I FEEL GUILTY LIKE I SHOULD BE DOING MORE THAN JUST SITTING A... https://t.co/XsB2cA50Ci"
lisadaniels3,"BOOTY WORSHIP , OILED MY BOOTY,AND FINGER FUCKED ME AND MY ASSHOLE  https://t.co/JzFrDhmkmy"
lisadaniels3,Are you ready to have fun? Subscribe at https://t.co/z65v1a6bir! https://t.co/YuypfE6Ywj
lisadaniels3,"Guess what, guys? One loyal fan has been following https://t.co/z65v1a6bir for six months... is it you??? https://t.co/uKm3EhUj15"
lisadaniels3,My profile https://t.co/z65v1a6bir got another rebill just moments ago. Waiting on the next one ;) https://t.co/EqUBZdvcdp
lisadaniels3,Site is back up cum check it out new content updated weekly https://t.co/KP7iQ2hYgN https://t.co/5FnZQan9Sp
lisadaniels3,IT'S OFFICIAL I'M STUCK IN COLOMBIA UNTIL QUARANTINE HAS BEEN LIFTED  2 PASS BOREDOM MEET ME ON MY O.F I WILL BE... https://t.co/ZOi2bRqwGE
lisadaniels3,Psst...subscribe now at https://t.co/z65v1a6bir so I can share my content with you! https://t.co/orDMuL9tLu
lisadaniels3,Hey guys! Big thanks today to a loyal fan who has followed me at https://t.co/z65v1a6bir for six months! https://t.co/j8ooqQNov9
lisadaniels3,Cum play with me on https://t.co/KP7iQ2hYgN https://t.co/U7IjL0YDYr
lisadaniels3,Come on! Subscribe to my super exclusive content on my personal FanCentro profile https://t.co/z65v1a6bir! You won'... https://t.co/7qPDeoIzAU
lisadaniels3,Woohoo! I've got a loyal subscriber here https://t.co/z65v19OzTR! Six months strong! https://t.co/IyrjddSoQY
lisadaniels3,An awesome fan just rebilled on my profile https://t.co/z65v1a6bir! Who else wants to stay? https://t.co/p7AGnPJ2ul
lisadaniels3,fishnets and lace picture set on https://t.co/KP7iQ2hYgN https://t.co/dZO901Xn0i
lisadaniels3,Sweet! I just got a rebill from a subscriber on my profile https://t.co/z65v1a6bir! https://t.co/kndVorTm4f
lisadaniels3,Need a new way to pass the time? Subscribe to https://t.co/z65v1a6bir. I bet I can help! https://t.co/xijz7OAqrt
lisadaniels3,Another rebill on my personal profile https://t.co/z65v1a6bir by a loyal fan! ;) https://t.co/qUrpYXUH6R
lisadaniels3,How do I find my biggest fans? The ones who stick with me for six months are a good start! Thanks for the support!... https://t.co/fsrOOa9RMi
lisadaniels3,YOU could be my newest subscriber at https://t.co/z65v1a6bir! I'm waiting to say hello. https://t.co/rcswpRe6ol
lisadaniels3,Yaas! I've got a very loyal fan at https://t.co/z65v1a6bir... they've been following for six months! Thanks! https://t.co/lVFWO8ePQQ
lisadaniels3,Love His Cock Deep In My Throat. https://t.co/JzFrDhmkmy
lisadaniels3,"DR FEELGOOD,  WATCH MY DOCTOR FILL ME UP &amp; FIND OUT ALL THE PROCEDURES I'M... https://t.co/JzFrDhmkmy"
lisadaniels3,Curious about my profile? Subscribe at https://t.co/z65v1a6bir! https://t.co/0f3wEmwvIs
lisadaniels3,New scene on https://t.co/KP7iQ2hYgN https://t.co/me4qFctfvJ
lisadaniels3,Wow! I have a really loyal subscriber at https://t.co/z65v1a6bir -- they've stayed with me for 6 months. I really ap... https://t.co/wUA26KnuuK
lisadaniels3,https://t.co/Hp1v2XyFYX https://t.co/Hp1v2XyFYX https://t.co/Hp1v2XyFYX  https://t.co/nSEPY4ZhlW
lisadaniels3,INTRODUCING MY BRAND NEW LD PORNSTAR ACTION FIGURE  . I CAN'T WAIT TO START SH... https://t.co/JzFrDhmkmy
lisadaniels3,@Brazzers @KSLibraryGirl  
lisadaniels3,Your so cute babe  https://t.co/Euc3OH68BD
lisadaniels3,"RT @LisaAndVanessa: #MotivationMonday #Lesbian 

 @lisadaniels3 
 @MjPenthousePet 

#SexyWomen #GirlsonGirls #GirlsKissingGirls #Gi..."
lisadaniels3,FOLLOW MY ONLY FANS RIGHT NOW TO FIND OUT WHAT PROCEDURE I WILL BE HAVING IN COLOMBIA.   I WILL ONLY BE SHARING... https://t.co/DIYYGUkvwi
lisadaniels3,Are you ready to have fun? Subscribe at https://t.co/z65v19OzTR! https://t.co/4NWn5N8zaz
lisadaniels3,Public upskirt pic set on  https://t.co/KP7iQ20mSd https://t.co/drIckC7ywf
lisadaniels3,Longtime fans are the best! Thanks to the loyal follower who's been with me for six months! https://t.co/z65v1a6bir https://t.co/v2vYD4kxWX
lisadaniels3,I love tips! I just got another on https://t.co/z65v1a6bir! https://t.co/BriiPCH9cX
lisadaniels3,Love it! I just got another tip at https://t.co/z65v1a6bir. Thanks a million!!! https://t.co/b21XeWsSHy
lisadaniels3,POV BLOWJOB   WATCH AND SEE WHAT PART OF MY BODY HE ENDED UP CUMMING ON ... https://t.co/JzFrDhmkmy
lisadaniels3,My premium subscriptions are so much fun! Subscribe at my FanCentro profile https://t.co/z65v1a6bir to be a part of... https://t.co/N0SUyrCIbI
lisadaniels3,I love making my fans happy! I've got one who's been loyal to https://t.co/z65v1a6bir for six months. Thank you :) https://t.co/fp2KjRaj58
lisadaniels3,RT @KaylaPaigeX: Subscribe now and get a G/G/G vid in your inbox tonite!  https://t.co/zAzVvEnMvX
lisadaniels3,Have fun babe   https://t.co/60ZKhGf1AZ
lisadaniels3,JUST SO YOU GUYS KNOW WHEN I DO A COCK RATING VIDEO THERE ARE 5 CATEGORIES I JUD... https://t.co/JzFrDhmkmy
lisadaniels3,Get exciting updates every day on https://t.co/z65v1a6bir! https://t.co/K8pUZbuCzN
