username,text,cleaned_text
RichardDawkins,"RT @center4inquiry: Happy Friday. That's a thing humans say to each other, yes? I'm catching on! It's time for The Morning Heresy news roun...", happy friday thats a thing humans say to each other yes im catching on its time for the morning heresy news roun
RichardDawkins,"RT @center4inquiry: Oh hey. It's time once again for The Morning Heresy news roundup thread thing. We be busy today! 

https://t.co/eCKEFxa...", oh hey its time once again for the morning heresy news roundup thread thing we be busy today 
RichardDawkins,The Hands That Help - from the @rdfrs Newsletter https://t.co/qhLZlQCxMk,the hands that help   from the newsletter
RichardDawkins,"RT @center4inquiry: Welcome to The Morning Heresy news roundup for this 12th day of May, which a quick google told me is Root Canal Appreci...", welcome to the morning heresy news roundup for this th day of may which a quick google told me is root canal appreci
RichardDawkins,'Christopher Hitchens: the last interview &amp; other conversations' is a fine collection. The actual Last Interview pr... https://t.co/epg7Ozr1oI,christopher hitchens the last interview &amp other conversations is a fine collection the actual last interview pr
RichardDawkins,"I'm greatly enjoying 'Christopher Hitchens: the last interview &amp; other conversations'. Nice evisceration of a ""soph... https://t.co/Wz78LhZApG",im greatly enjoying christopher hitchens the last interview &amp other conversations nice evisceration of a soph
RichardDawkins,"For an object lesson in how to write perfect, seemingly effortless English prose, you'll struggle to find anything... https://t.co/HiVm9n2gpx",for an object lesson in how to write perfect seemingly effortless english prose youll struggle to find anything
RichardDawkins,"RT @center4inquiry: The Morning Heresy returns with another bunch of news and links! I, your oft-frazzled Morning Heretic, is back after ge...", the morning heresy returns with another bunch of news and links i your oft frazzled morning heretic is back after ge
RichardDawkins,RT @center4inquiry: Thursday at 7pm ET on Skeptical Inquirer Presents: Nina Burleigh Exposes the Failed COVID Response https://t.co/GiMjmEX..., thursday at pm et on skeptical inquirer presents nina burleigh exposes the failed covid response 
RichardDawkins,"It's dead centre, shaped like an S.  Look for a repeated triangle pattern along the back.

 For me it's not a case... https://t.co/HRfBShngQJ",its dead centre shaped like an s look for a repeated triangle pattern along the back for me its not a case
RichardDawkins,"Beethoven was moved to tears while writing this late quartet movement, and you can understand why. And he would wee... https://t.co/kG0hQWtUjE",beethoven was moved to tears while writing this late quartet movement and you can understand why and he would wee
RichardDawkins,Tomorrow morning I will be talking about Books Do Furnish a Life at @StratLitFest. You can get your ticket here:... https://t.co/DdY6ujX7UA,tomorrow morning i will be talking about books do furnish a life at  you can get your ticket here
RichardDawkins,https://t.co/8xEHEdwzBD,
RichardDawkins,"Of all camouflaged animals, this might be the most invisible I've ever (eventually) seen. https://t.co/UjNPr85yK4",of all camouflaged animals this might be the most invisible ive ever eventually seen
RichardDawkins,https://t.co/2WX0P2Sncd,
RichardDawkins,Next week I will be appearing at @StratLitFest to talk about Books Do Furnish a Life. You can find out more and boo... https://t.co/I0wPm6rw6W,next week i will be appearing at to talk about books do furnish a life you can find out more and boo
RichardDawkins,"A respectul, civilised exchange between two leading ex-Muslims.
https://t.co/UrWD8Yklha",a respectul civilised exchange between two leading ex muslims
RichardDawkins,https://t.co/qaxkEmCA96,
RichardDawkins,"RT @center4inquiry: Greetings, once again. Time for our Morning Heresy news roundup thread. 

Fair warning: no Heresy this Monday, so just...", greetings once again time for our morning heresy news roundup thread fair warning no heresy this monday so just
RichardDawkins,"RT @center4inquiry: Good morning, heretics. Time for today's news roundup thread. Look upon my links, ye mighty, and despair.

No wait, don...", good morning heretics time for todays news roundup thread look upon my links ye mighty and despairno wait don
RichardDawkins,It's publication day for Books Do Furnish a Life. Out now in hardback and available here: https://t.co/bdfH2DLnqp https://t.co/C41gZE4I8S,its publication day for books do furnish a life out now in hardback and available here
RichardDawkins,https://t.co/C7fk7lZZ83,
RichardDawkins,"RT @center4inquiry: It's your Morning Heresy news roundup, because who wouldn't want to wake up to ~~all this~~?

Today's episode-thread:...", its your morning heresy news roundup because who wouldnt want to wake up to ~~all this~~todays episode thread
RichardDawkins,Tomorrow night @penguinlive are hosting a discussion between me and @mattwridley about contemporary science and Boo... https://t.co/wdxKsbMNpI,tomorrow night are hosting a discussion between me and about contemporary science and boo
RichardDawkins,"RT @center4inquiry: The Morning Heresy! It's a news roundup! For reality-based folks! What a world. 

Today's thread-episode (threadisode?)...", the morning heresy its a news roundup for reality based folks what a world todays thread episode threadisode
RichardDawkins,"RT @center4inquiry: Welcome to a new week, heretics. Time for The Morning Heresy's roundup-thread of all the weird, disturbing, and bewilde...", welcome to a new week heretics time for the morning heresys roundup thread of all the weird disturbing and bewilde
RichardDawkins,Books Do Furnish a Life is out in hardback on Thursday. It brings together my commentaries on the very best contemp... https://t.co/LPv5hkyPqz,books do furnish a life is out in hardback on thursday it brings together my commentaries on the very best contemp
RichardDawkins,https://t.co/lQSrIJiHOk,
RichardDawkins,Astrology believers in millions-strong superspreader event. Sun entering Aries &amp; Jupiter in Aquarius so it had to b... https://t.co/Ek19AaWLFo,astrology believers in millions strong superspreader event sun entering aries &amp jupiter in aquarius so it had to b
RichardDawkins,"A ""horse or dog is a more rational, as well as a more conversable animal, than an infant of . . . even a month, old... https://t.co/cuFwUaavQX",a horse or dog is a more rational as well as a more conversable animal than an infant of    even a month old
RichardDawkins,https://t.co/TGwZB3kz7R,
RichardDawkins,"A thought-provoking discussion.
https://t.co/0yQ3XpG3Y2",a thought provoking discussion
RichardDawkins,Next week @mattwridley and I will be discussing Books Do Furnish a Life @penguinlive. You can get tickets here:... https://t.co/cTuzPyLLAM,next week and i will be discussing books do furnish a life  you can get tickets here
RichardDawkins,"Einstein allows that time-travel to future is possible, by moving at near light speed. But unlike HG Wells's hero y... https://t.co/BGjxoh5S1f",einstein allows that time travel to future is possible by moving at near light speed but unlike hg wellss hero y
RichardDawkins,"Physicists say there's nothing special about the apparently creeping present. So, is backwards time-travel possible... https://t.co/LHji35Nutp",physicists say theres nothing special about the apparently creeping present so is backwards time travel possible
RichardDawkins,"Sci-Fi writers have proposed this paradox. If we send a spaceship to another star system, it would take so long, &amp;... https://t.co/9EQeM9sYSD",sci fi writers have proposed this paradox if we send a spaceship to another star system it would take so long &amp
RichardDawkins,"RT @center4inquiry: Oh hey, welcome to the news roundup we call The Morning Heresy. Clever, right? Because we're, like, heretics or somethi...", oh hey welcome to the news roundup we call the morning heresy clever right because were like heretics or somethi
RichardDawkins,https://t.co/bL3QFRVkNP,
RichardDawkins,RT @center4inquiry: Good morning. Totally don't have my nerves pulled taut over what the Supreme Court might have to say today. Nope nope...., good morning totally dont have my nerves pulled taut over what the supreme court might have to say today nope nope
RichardDawkins,Transgender wars https://t.co/FAGnVjvsRt via @fsrcoin,transgender wars via
RichardDawkins,Richard Dawkins is an ally to the oppressed https://t.co/CKjkIxzSzK via @spectator,richard dawkins is an ally to the oppressed via
RichardDawkins,Some monkeys in Panama may have just stumbled into the Stone Age https://t.co/V9jFyKEwqI,some monkeys in panama may have just stumbled into the stone age
RichardDawkins,https://t.co/XBzGjfgHkK,
RichardDawkins,Unbelievable Change https://t.co/mCKyPSJjth,unbelievable change
RichardDawkins,"RT @center4inquiry: Today's Morning Heresy news roundup is, like, a lot. It's a lot. 

Shall we thread? 

Today's episode: ""Provocative and...", todays morning heresy news roundup is like a lot its a lot shall we thread todays episode provocative and
RichardDawkins,Books Do Furnish a Life is available for pre-order here: https://t.co/bdfH2DLnqp https://t.co/lWKcgJIBQ4,books do furnish a life is available for pre order here
RichardDawkins,RT @ahmpreston: Very much looking forward to speaking to @RichardDawkins about his wonderful collection Books Do Furnish a Life for @StratL..., very much looking forward to speaking to about his wonderful collection books do furnish a life for 
RichardDawkins,RT @Bai_ley_Harris: I'm so excited! We're launching a Kickstarter for our new puzzle set next week! You can sign up to be alerted when it g..., im so excited were launching a kickstarter for our new puzzle set next week you can sign up to be alerted when it g
RichardDawkins,"RT @center4inquiry: Happy morning, tra-la-la. The sun is shining and one day it will expand and subsume the inner planets. Let's round up t...", happy morning tra la la the sun is shining and one day it will expand and subsume the inner planets lets round up t
RichardDawkins,"Somebody suggested that it's not a worm. Hard to see, but it could be a millipede. Whatever it is, it's an utterly... https://t.co/66QIoB58di",somebody suggested that its not a worm hard to see but it could be a millipede whatever it is its an utterly
RichardDawkins,"Look at this astonishing film. The ants have found a worm, but it's much too heavy for one ant to drag back to the... https://t.co/QIkN2wPAbx",look at this astonishing film the ants have found a worm but its much too heavy for one ant to drag back to the
RichardDawkins,"RT @center4inquiry: Time for The Morning Heresy news roundup, you lucky people.

Today's episode, ""Surrendering to Apathy and Distraction.""...", time for the morning heresy news roundup you lucky peopletodays episode surrendering to apathy and distraction
RichardDawkins,"The Oxford Handbook of Atheism, Edited by Stephen Bullivant and Michael Ruse, is a useful encyclopedia written by m... https://t.co/dPVM58yvZo",the oxford handbook of atheism edited by stephen bullivant and michael ruse is a useful encyclopedia written by m
RichardDawkins,"My new book Books Do Furnish a Life is out on 6th May. It celebrates nature, explores our humanity, and interrogate... https://t.co/qxaFnn6b7q",my new book books do furnish a life is out on th may it celebrates nature explores our humanity and interrogate
RichardDawkins,"RT @center4inquiry: Good morning, heretics. Today is the 457th birthday of William Shakespeare. If I were less sleepy right now, I'd do the...", good morning heretics today is the th birthday of william shakespeare if i were less sleepy right now id do the
RichardDawkins,"Wonderful! Utterly wonderful.

https://t.co/EW1BsExhlJ

https://t.co/vmTVQFFoAt

https://t.co/tWcjOyCeHz",wonderful utterly wonderful
RichardDawkins,https://t.co/6wy5TQes2y,
RichardDawkins,"Sorry if posting this seems immodest. But @JuliaGalef in 2015 expressed so EXACTLY what I try to do when I say ""Dis... https://t.co/Pk38pzAhz4",sorry if posting this seems immodest but in expressed so exactly what i try to do when i say dis
RichardDawkins,In 2 weeks @mattwridley and I will be taking part in a @penguinlive event to discuss my new book Books Do Furnish a... https://t.co/vdOjBQ1J8l,in weeks and i will be taking part in a event to discuss my new book books do furnish a
RichardDawkins,RT @center4inquiry: Gaze in awe at the links that hath been given as a boon to thee! Yea! Lo! Behold! News hath been gathered on this elect..., gaze in awe at the links that hath been given as a boon to thee yea lo behold news hath been gathered on this elect
RichardDawkins,"Always a pleasure to talk to @andrewcopson, and I greatly enjoyed going on the podcast of @Humanists_UK, of which a... https://t.co/yNxXvtAz7D",always a pleasure to talk to  and i greatly enjoyed going on the podcast of  of which a
RichardDawkins,In 2 weeks @mattwridley and I will be taking part in a @penguinlive event to discuss my new book Books Do Furnish a... https://t.co/a2PuEDskOt,in weeks and i will be taking part in a event to discuss my new book books do furnish a
RichardDawkins,"Finally, we have recorded the audio version of Unweaving the Rainbow and it is now available. Narrated by me, with... https://t.co/dkQnqBmuS5",finally we have recorded the audio version of unweaving the rainbow and it is now available narrated by me with
RichardDawkins,"Vaguely apropos, and sad in the same kind of way, Darwin mentioned ""a parrot which was the sole living creature tha... https://t.co/08xKMyxpic",vaguely apropos and sad in the same kind of way darwin mentioned a parrot which was the sole living creature tha
RichardDawkins,They have suggestions for how the Creator might have done a better job with the human body. Reminds me of 1 that ma... https://t.co/IIkPHllAkD,they have suggestions for how the creator might have done a better job with the human body reminds me of that ma
RichardDawkins,"May or might? Not pedantic, there really is a useful distinction. Often doesn't matter. But a hypothetical if state... https://t.co/DKJSFnlm1j",may or might not pedantic there really is a useful distinction often doesnt matter but a hypothetical if state
RichardDawkins,"Censorship. Why has @TEDTalks kowtowed under fashionable pressure to remove so-called ""distressing or objectionable... https://t.co/9qocd9Hazc",censorship why has kowtowed under fashionable pressure to remove so called distressing or objectionable
RichardDawkins,"RT @center4inquiry: Oh hi. I was out the last couple of mornings, so there's a ton to catch up on with today's Morning Heresy news roundup....", oh hi i was out the last couple of mornings so theres a ton to catch up on with todays morning heresy news roundup
RichardDawkins,"Audio reading Not Very Good Design, written &amp; read by Ingman bros. Accents sound NZ, which suggests that NZ humour... https://t.co/tO6x8CzGzt",audio reading not very good design written &amp read by ingman bros accents sound nz which suggests that nz humour
RichardDawkins,https://t.co/2abJqDq85w,
RichardDawkins,"My new book, Books Do Furnish a Life, is out on 6th May. It's a celebration of the most exciting ideas of our time,... https://t.co/1JE5KGw1KP",my new book books do furnish a life is out on th may its a celebration of the most exciting ideas of our time
RichardDawkins,"There's only a few ways to make an eye &amp; natural selection has discovered them all. If there's alien life, it's saf... https://t.co/VLRI4ruyY2",theres only a few ways to make an eye &amp natural selection has discovered them all if theres alien life its saf
RichardDawkins,"Life's Solution by Simon Conway Morris is a work of prodigious scholarship, pleasantly written with spikes of humou... https://t.co/kzBygUDQE2",lifes solution by simon conway morris is a work of prodigious scholarship pleasantly written with spikes of humou
RichardDawkins,https://t.co/0ORHU3Mmlz,
RichardDawkins,"RT @SkeptInquirer: How to Help Your Conspiracy Theorist Friend: Mick West on Skeptical Inquirer Presents, April 29 https://t.co/cpqtd9LrQA...", how to help your conspiracy theorist friend mick west on skeptical inquirer presents april 
RichardDawkins,https://t.co/OZ1bsX1YW2,
RichardDawkins,"RT @VerumRebus: Blackboard in foyer of a Barclays Bank in Wiltshire.  In the spirit of inclusion, will all religions be represented in this...", blackboard in foyer of a barclays bank in wiltshire in the spirit of inclusion will all religions be represented in this
RichardDawkins,"Bogged down in Hayek, took a break with Nigel Lambert's nice reading of Service with a Smile. Evelyn Waugh got it r... https://t.co/k10AlPz1bH",bogged down in hayek took a break with nigel lamberts nice reading of service with a smile evelyn waugh got it r
RichardDawkins,How Your Brain Understands the World and Why It Sometimes Gets It Wrong ... https://t.co/J0ZQGqu3xe via @YouTube,how your brain understands the world and why it sometimes gets it wrong  via
RichardDawkins,"RT @center4inquiry: There's a particularly odd mix of stories today for The Morning Heresy news roundup. 

Whatevs. Let's get newsified wit...", theres a particularly odd mix of stories today for the morning heresy news roundup whatevs lets get newsified wit
RichardDawkins,"RT @NightwatchmanXI:  Nice shot, Steve! 

Former Australian captain Steve Waugh has won the Wisden Cricket Photograph of the Year competit...", nice shot steve former australian captain steve waugh has won the wisden cricket photograph of the year competit
RichardDawkins,"RT @JannaLevin: Richard Dawkins, like Leon Lederman, manages to offend two groups. (Dawkins reminds us of the bumper sticker ""Blasphemy is...", richard dawkins like leon lederman manages to offend two groups dawkins reminds us of the bumper sticker blasphemy is
RichardDawkins,"RT @center4inquiry: Time for The Morning Heresy news roundup for all you smart folks who think reality is important. Today's episode, ""Enfo...", time for the morning heresy news roundup for all you smart folks who think reality is important todays episode enfo
RichardDawkins,"Nidicolous baby birds are unlike adults, though less so than caterpillars. Google ""bird nestlings"" for Images of th... https://t.co/VT1FuXr7ss",nidicolous baby birds are unlike adults though less so than caterpillars google bird nestlings for images of th
RichardDawkins,Split phenotypes have long been a challenging talking-point for Darwinians. DI Williamson in 'Larvae and Evolution'... https://t.co/lqowivi1Ti,split phenotypes have long been a challenging talking point for darwinians di williamson in larvae and evolution
RichardDawkins,"Flowering plant has phase of growth when no flowers produced (the ""caterpillar phase""), then suddenly flowers burst... https://t.co/BWDBmt8jUI",flowering plant has phase of growth when no flowers produced the caterpillar phase then suddenly flowers burst
RichardDawkins,"Split phenotypes:-

We mammals are used to the idea that a baby is a miniature adult which inflates.

Frogs &amp; most... https://t.co/NFtU9cQdUu",split phenotypes we mammals are used to the idea that a baby is a miniature adult which inflatesfrogs &amp most
RichardDawkins,https://t.co/EpHrQpkv53,
RichardDawkins,"The right way to disagree : ""I think you're wrong because . . . the evidence shows . . . there's a flaw in your log... https://t.co/x44rA8kubO",the right way to disagree  i think youre wrong because    the evidence shows    theres a flaw in your log
RichardDawkins,https://t.co/Tme5RwMwHH,
RichardDawkins,RT @SkeptInquirer: Tomorrow! Jeff Hawkins on Skeptical Inquirer Presents: How Our Brains Understand (and Misunderstand) the World https://t..., tomorrow jeff hawkins on skeptical inquirer presents how our brains understand and misunderstand the world 
RichardDawkins,Is this the jobsworth story to end all jobsworths? Or do you have a better one? https://t.co/mrYFvqyYfZ,is this the jobsworth story to end all jobsworths or do you have a better one
RichardDawkins,Hayek notes interesting asymmetry re origins of trade. Where food or perishable goods are traded for keepables (eg... https://t.co/0SQWX4yr1c,hayek notes interesting asymmetry re origins of trade where food or perishable goods are traded for keepables eg
RichardDawkins,"RT @center4inquiry: Warm up your brains, it's time for your news roundup with The Morning Heresy. Today's episode, ""Flat and Cold."" Thread...", warm up your brains its time for your news roundup with the morning heresy todays episode flat and cold thread
RichardDawkins,"Audio-reading Hayek's critique of Socialism (notwithstanding one Amazon reviewer who, while agreeing with Hayek's t... https://t.co/aDKZOFbXNy",audio reading hayeks critique of socialism notwithstanding one amazon reviewer who while agreeing with hayeks t
RichardDawkins,https://t.co/kBhQudOUa3,
RichardDawkins,https://t.co/u1XGRzfZEo,
RichardDawkins,This was supposed to be a Reply to my tweet recommending 'A Short History of Humanity' by Johannes Krause &amp; Thomas Trappe. Apologies.,this was supposed to be a reply to my tweet recommending a short history of humanity by johannes krause &amp thomas trappe apologies
RichardDawkins,"The native hunter-gatherers lived cheek-by-jowl with the immigrant farmers for a long time, and they sometimes inte... https://t.co/FXtekXzBgf",the native hunter gatherers lived cheek by jowl with the immigrant farmers for a long time and they sometimes inte
RichardDawkins,"DNA evidence in history can be as powerful as written evidence.  I suppose it IS a form of written evidence, but ne... https://t.co/yRb2GL0Fe9",dna evidence in history can be as powerful as written evidence i suppose it is a form of written evidence but ne
RichardDawkins,Reading 'A Short History of Humanity' by Johannes Krause &amp; Thomas Trappe. Krause discovered the Denisovans from DNA... https://t.co/lRznnCLL5Y,reading a short history of humanity by johannes krause &amp thomas trappe krause discovered the denisovans from dna
RichardDawkins,"RT @center4inquiry: It's the 103rd day of 2021, and it's time for some news, curated with care and not a little bit of exasperation by your...", its the rd day of  and its time for some news curated with care and not a little bit of exasperation by your
RichardDawkins,"I do not intend to disparage trans people. I see that my academic ""Discuss"" question has been misconstrued as such... https://t.co/3KLjm79mts",i do not intend to disparage trans people i see that my academic discuss question has been misconstrued as such
RichardDawkins,"RT @center4inquiry: G'mornin'. Get yourself a tasty beverage and hunker down for some news and links, lovingly and skeptically rounded up i...", gmornin get yourself a tasty beverage and hunker down for some news and links lovingly and skeptically rounded up i
RichardDawkins,https://t.co/cOW83Z4JxZ,
RichardDawkins,"""The most incomprehensible thing about the world is that it is at all comprehensible"" (Albert Einstein).

But what... https://t.co/VA0QNplH6q",the most incomprehensible thing about the world is that it is at all comprehensible albert einsteinbut what
RichardDawkins,"Most Catholics don't believe the official dogma:

""... the entire substance of the bread and the entire substance of... https://t.co/3WaIiOavQs",most catholics dont believe the official dogma the entire substance of the bread and the entire substance of
RichardDawkins,Existing words change meaning by gradual evolution. Or a redefinition or refinement is proposed &amp; voluntarily adopt... https://t.co/3NXy4EeqSS,existing words change meaning by gradual evolution or a redefinition or refinement is proposed &amp voluntarily adopt
RichardDawkins,"Roman Catholics are required to believe that communion wine actually is literally the blood of Christ, and the wafe... https://t.co/RQro7GAsIS",roman catholics are required to believe that communion wine actually is literally the blood of christ and the wafe
RichardDawkins,"""Don't you see that the whole aim of Newspeak is to narrow the range of thought? In the end we shall make thoughtcr... https://t.co/626jRQ99As",dont you see that the whole aim of newspeak is to narrow the range of thought in the end we shall make thoughtcr
RichardDawkins,"HALF close your eyelids, loosen your hair,
And dream about the great and their pride;
They have spoken against you... https://t.co/ReKEZCK1Kn",half close your eyelids loosen your hairand dream about the great and their pridethey have spoken against you
RichardDawkins,May have to give up listening to audio edition of Popper's Open Society because so badly read. Every sentence spoke... https://t.co/128z9nzlaG,may have to give up listening to audio edition of poppers open society because so badly read every sentence spoke
RichardDawkins,"In 2015, Rachel Dolezal, a white chapter president of NAACP, was vilified for identifying as Black. Some men choose... https://t.co/zCshd9kAcd",in  rachel dolezal a white chapter president of naacp was vilified for identifying as black some men choose
RichardDawkins,"Philip ""was said to have so little patience with horse racing that he had his top hat fitted with a radio so that h... https://t.co/cYMVYeOa2Z",philip was said to have so little patience with horse racing that he had his top hat fitted with a radio so that h
RichardDawkins,"RT @center4inquiry: It's a crazy, dark world, but at least you have The Morning Heresy news roundup to light your way, or at least give you...", its a crazy dark world but at least you have the morning heresy news roundup to light your way or at least give you
