username,text,cleaned_text
RichardDawkins,"RT @center4inquiry: It's time for another roundup of the news of interest to heathens and buzzkills everywhere, The Morning Heresy, today t...", its time for another roundup of the news of interest to heathens and buzzkills everywhere the morning heresy today t
RichardDawkins,"The Holwerda brothers, talented makers of #TheUnbelievers, have created an intriguing, mysterious, thought-provokin... https://t.co/i5m5PYxeG0",the holwerda brothers talented makers of  have created an intriguing mysterious thought provokin
RichardDawkins,Scientific  American is easily the top journal of popular science in the world. It's one of the things that makes A... https://t.co/bf0CdDM7xN,scientific american is easily the top journal of popular science in the world its one of the things that makes a
RichardDawkins,Outgrowing God is out in paperback tomorrow. You can order your copy here. https://t.co/cL4HvqrpN1 https://t.co/aqEwAmyrl3,outgrowing god is out in paperback tomorrow you can order your copy here
RichardDawkins,https://t.co/XTKjJbN7fW,
RichardDawkins,"RT @center4inquiry: Happy Tuesday, heretics. And a big hello to our friends on Venus, assuming they get internet over there. It's time for...", happy tuesday heretics and a big hello to our friends on venus assuming they get internet over there its time for
RichardDawkins,I just signed a statement calling on intl community to condemn #NavidAfkari execution &amp; boycott Iranian regime in i... https://t.co/zar6pRN2Ef,i just signed a statement calling on intl community to condemn execution &amp boycott iranian regime in i
RichardDawkins,"Outgrowing God will introduce atheism to people of all ages and explores questions about morality, religion and sci... https://t.co/hLRIdcFnfJ",outgrowing god will introduce atheism to people of all ages and explores questions about morality religion and sci
RichardDawkins,"RT @center4inquiry: Good morning, heretics. Let's see what fresh hell the news hath brought this day with CFI's news roundup, The Morning H...", good morning heretics lets see what fresh hell the news hath brought this day with cfis news roundup the morning h
RichardDawkins,"Last year @RevRichardColes and I discussed my book, Outgrowing God, religion and the nature of belief. You can read... https://t.co/3X63hlgaMM",last year and i discussed my book outgrowing god religion and the nature of belief you can read
RichardDawkins,"RT @center4inquiry: The Absurd Logical Conclusion - Your guide to the rabbit hole, The Morning Heresy. https://t.co/cJBtBz6Ret", the absurd logical conclusion   your guide to the rabbit hole the morning heresy
RichardDawkins,Outgrowing God is out in paperback in the UK next week. It explores how much of what we know about religion is true... https://t.co/3jJ5PSYHUm,outgrowing god is out in paperback in the uk next week it explores how much of what we know about religion is true
RichardDawkins,RT @YasMohammedxx: I know a woman having the right to choose where she wants to live is not historic to most of you--it is a common right af..., i know a woman having the right to choose where she wants to live is not historic to most of you  it is a common right af
RichardDawkins,"RT @center4inquiry: Walk Around in Circles - When you were languishing in rooms I built to file you in, you read The Morning Heresy.
https:...", walk around in circles   when you were languishing in rooms i built to file you in you read the morning heresyhttps
RichardDawkins,https://t.co/e2PDaZiVCK,
RichardDawkins,"RT @center4inquiry: Exacerbating Outpartisans - The Morning Heresy
https://t.co/Uh3gpHAbsM", exacerbating outpartisans   the morning heresy
RichardDawkins,https://t.co/drR2s02wkj,
RichardDawkins,RT @center4inquiry: Crowbars and Hermit Crabs - The Morning Heresy pries open the news and doesn't like what it sees. https://t.co/XXOoj3HI..., crowbars and hermit crabs   the morning heresy pries open the news and doesnt like what it sees 
RichardDawkins,"""My curry's too hot."" But do you mean temperature too high? Or too much chili? Impossible to tell, owing to a curio... https://t.co/DVTgL5RxlX",my currys too hot but do you mean temperature too high or too much chili impossible to tell owing to a curio
RichardDawkins,"How utterly ridiculous. The museum should contemptuously ignore this nonsense.
https://t.co/u0kiQ2McoB",how utterly ridiculous the museum should contemptuously ignore this nonsense
RichardDawkins,"RT @center4inquiry: Legislating Sanity - The Morning Heresy filibusters the news. 
https://t.co/Pyv9zIhn3i", legislating sanity   the morning heresy filibusters the news
RichardDawkins,RT @center4inquiry: Traditionally Mask-uline (Get It?) - The Morning Heresy is tough love for the news.  https://t.co/d1KWp5BA8L, traditionally mask uline get it   the morning heresy is tough love for the news
RichardDawkins,"RT @center4inquiry: Awkward, Contradictory, and Self-Defeating - The Morning Heresy is helping! 
https://t.co/50iHPU0rYk", awkward contradictory and self defeating   the morning heresy is helping
RichardDawkins,RT @center4inquiry: Say No More - The Morning Heresy winks and nods at the news. https://t.co/U3sXEUKR1y, say no more   the morning heresy winks and nods at the news
RichardDawkins,RT @center4inquiry: No Sleep for the Pious - Lie awake at night worrying about what's in The Morning Heresy. https://t.co/4vcD0YA0NF, no sleep for the pious   lie awake at night worrying about whats in the morning heresy
RichardDawkins,Risk-taking decisions not all-or-none. Add up. Safety measures add up. Every time you take calculated risk to socia... https://t.co/jPypL8SLNF,risk taking decisions not all or none add up safety measures add up every time you take calculated risk to socia
RichardDawkins,"RT @center4inquiry: Jiggery-Pokery Redux - The Morning Heresy misinterprets the news. 
https://t.co/t3IxSHHhoR https://t.co/vCehuOk3uJ", jiggery pokery redux   the morning heresy misinterprets the news
RichardDawkins,https://t.co/7Tuaa6yNwJ,
RichardDawkins,The Little Book of Humanism by Andrew Copson &amp; Alice Roberts is a delight. Give it like a bunch of flowers to someo... https://t.co/kFzhnubfAS,the little book of humanism by andrew copson &amp alice roberts is a delight give it like a bunch of flowers to someo
RichardDawkins,RT @center4inquiry: TONIGHT 7pm ET: Carol Tavris discusses pandemic-denial and cognitive dissonance on 'Skeptical Inquirer Presents.' Regis..., tonight pm et carol tavris discusses pandemic denial and cognitive dissonance on skeptical inquirer presents regis
RichardDawkins,RT @center4inquiry: A Valiant Ford - The Morning Heresy is a very preux gue blog. https://t.co/6CLW8iDBWK, a valiant ford   the morning heresy is a very preux gue blog
RichardDawkins,Of course we should fight to save this individual life. But also fight the principle of legal punishment for harmle... https://t.co/0mtXFULxhG,of course we should fight to save this individual life but also fight the principle of legal punishment for harmle
RichardDawkins,"Atheist hero in Nigeria arrested by ignorant faith-heads:
https://t.co/Ica1YsBFVl",atheist hero in nigeria arrested by ignorant faith heads
RichardDawkins,RT @center4inquiry: An Aggressive Yank - The Morning Heresy tugs at the news until it snaps. https://t.co/IZVv8aG920, an aggressive yank   the morning heresy tugs at the news until it snaps
RichardDawkins,"RT @center4inquiry: The role of freethought has been largely whitewashed from the history of the #suffrage movement, but secularism was a d...", the role of freethought has been largely whitewashed from the history of the movement but secularism was a d
RichardDawkins,RT @center4inquiry: Conspiracies Grow as COVID Spreads https://t.co/e3MFE4z0nQ, conspiracies grow as covid spreads
RichardDawkins,"For the whole month of August, the e-book (""Kindle"") edition of Outgrowing God is available at the cut price of PS1.99.",for the whole month of august the e book kindle edition of outgrowing god is available at the cut price of ps199
RichardDawkins,RT @center4inquiry: The R-naught is Rising - The pre-flattened news of the Morning Heresy https://t.co/HiEALv6PqK, the r naught is rising   the pre flattened news of the morning heresy
RichardDawkins,https://t.co/lbzs3Af0H0,
RichardDawkins,https://t.co/4S7j0DdAiB,
RichardDawkins,RT @ExmuslimsOrg: No one should be killed or persecuted for leaving their religion! #ApostasyNotACrime #ApostasyDay https://t.co/AsghbebGI1, no one should be killed or persecuted for leaving their religion
RichardDawkins,"RT @moolecular: #ApostasyNotACrime
22 Aug, 1st Intl Apostasy Day 
https://t.co/NaAJlJQyJL
#ApostasyDay commemorates victims of apostasy law...", aug st intl apostasy day commemorates victims of apostasy law
RichardDawkins,"RT @center4inquiry: Just Asking Questions Here - Hey, don't blame the Morning Heresy.
https://t.co/z4b1pHH6va", just asking questions here   hey dont blame the morning heresy
RichardDawkins,"RT @TransworldBooks: For anyone hoping to grapple with the meaning of life and what to believe, Outgrowing God by @RichardDawkins is a chal...", for anyone hoping to grapple with the meaning of life and what to believe outgrowing god by is a chal
RichardDawkins,"RT @moolecular: 22 Aug, 1st Intl Apostasy Day

#ApostasyDay commemorates victims of apostasy laws, calls for end of criminalisation &amp; the d...", aug st intl apostasy day commemorates victims of apostasy laws calls for end of criminalisation &amp the d
RichardDawkins,Please listen to this superb Oxford Amnesty lecture by the Cambridge psychologist Nicholas Humphrey. If no time for... https://t.co/32WYKDSznx,please listen to this superb oxford amnesty lecture by the cambridge psychologist nicholas humphrey if no time for
RichardDawkins,RT @center4inquiry: Just Making Stuff Up - News right off the top of our head: The Morning Heresy. https://t.co/k1K4HCcuFv, just making stuff up   news right off the top of our head the morning heresy
RichardDawkins,RT @center4inquiry: Toxic Pillows - Another sleepless Morning Heresy. https://t.co/xOYh3gDVTD, toxic pillows   another sleepless morning heresy
RichardDawkins,"Why do Americans, for example in banks, give the name ""pound"" to what is actually the musical sharp symbol, #? Seem... https://t.co/E4XWGs3CwE",why do americans for example in banks give the name pound to what is actually the musical sharp symbol  seem
RichardDawkins,"Peter Medawar said literary scholars, contemporaries of Jim Watson, were every bit as clever as Watson himself.  ""B... https://t.co/qqnLtXZunv",peter medawar said literary scholars contemporaries of jim watson were every bit as clever as watson himself b
RichardDawkins,"The theory of natural selection is one of the most powerful theories ever proposed, for from a simple acorn of an i... https://t.co/AZVG2WFSFo",the theory of natural selection is one of the most powerful theories ever proposed for from a simple acorn of an i
RichardDawkins,"RT @center4inquiry: Verifiably False Claims about Actual Human Beings - 
The Morning Heresy [citation needed] 
https://t.co/Uw1wxCR92Y", verifiably false claims about actual human beings   the morning heresy citation needed
RichardDawkins,RT @center4inquiry: A Sample Size of That One Guy - The Morning Heresy adjusts your priors. https://t.co/z8wd906vas, a sample size of that one guy   the morning heresy adjusts your priors
RichardDawkins,RT @center4inquiry: Burping Stars and Zombie Pigs - Thank Zod it's Friday for the Morning Heresy. https://t.co/26blVKyi9d, burping stars and zombie pigs   thank zod its friday for the morning heresy
RichardDawkins,"RT @center4inquiry: Broken Dishes - The Morning Heresy picks up the shattered pieces of the news, watching out for sharp edges. https://t.c...", broken dishes   the morning heresy picks up the shattered pieces of the news watching out for sharp edges 
RichardDawkins,https://t.co/23tKJFm2xy,
RichardDawkins,https://t.co/u9yn5F0QGe,
RichardDawkins,"RT @center4inquiry: Undermine the Entire Enterprise - The news roundup that defeats itself, The Morning Heresy.
https://t.co/PU0mSDqrXl", undermine the entire enterprise   the news roundup that defeats itself the morning heresy
RichardDawkins,RT @center4inquiry: Dangerous Advice - The Morning Heresy gets the news from the belly of the beast. https://t.co/kkjfYBHXHA, dangerous advice   the morning heresy gets the news from the belly of the beast
RichardDawkins,https://t.co/zcYCdAfl4y,
RichardDawkins,"RT @center4inquiry: The Great Oversimplifiers - The Morning Heresy rounds up the news, which is all fine. It's fine. IT'S FINE.
https://t.c...", the great oversimplifiers   the morning heresy rounds up the news which is all fine its fine its fine
RichardDawkins,"This is truly shocking:

https://t.co/DkqeV8IJFB",this is truly shocking
RichardDawkins,"RT @center4inquiry: No Religion! No Anything! - The Morning Heresy is the news blog that's AGAINST EVERYTHING.
https://t.co/WFIYamAk9H", no religion no anything   the morning heresy is the news blog thats against everything
RichardDawkins,"""[Darwin] was a genius of the first rank and a man of immense learning, and he often worked a century or more ahead... https://t.co/S0UsyEdmuF",darwin was a genius of the first rank and a man of immense learning and he often worked a century or more ahead
RichardDawkins,RT @center4inquiry: Closed and Dead - The Morning Heresy single-handedly saves the entire news industry. (That is not at all true.) https:/..., closed and dead   the morning heresy single handedly saves the entire news industry that is not at all true https 
RichardDawkins,"RT @center4inquiry: Canadian Info Ninjas - The heroes we need, and probably don't deserve, in the Morning Heresy. https://t.co/nAEICivOHf", canadian info ninjas   the heroes we need and probably dont deserve in the morning heresy
RichardDawkins,RT @center4inquiry: Warp Speed Bucket - The Morning Heresy blasts off into a black hole of news. https://t.co/Jo2FG4hwGo, warp speed bucket   the morning heresy blasts off into a black hole of news
RichardDawkins,RT @center4inquiry: An Unstable Foundation - News that wobbles in the Morning Heresy. https://t.co/3ZveCJyo9p, an unstable foundation   news that wobbles in the morning heresy
RichardDawkins,"RT @center4inquiry: Yes, I'm a Demon Buster. - Dogs and cats live together in The Morning Heresy. https://t.co/SG1mD5ct5p", yes im a demon buster   dogs and cats live together in the morning heresy
RichardDawkins,RT @center4inquiry: Holding Their Noses - The unbearable stench of news in the Morning Heresy. https://t.co/Lyq3RKAWln, holding their noses   the unbearable stench of news in the morning heresy
RichardDawkins,https://t.co/yo6HAVnNrj,
RichardDawkins,https://t.co/XTlS5B8eE0,
RichardDawkins,"RT @RDFTranslations: ymknkm lan tHmyl ktb ""lnhr lkhrj mn `dn"" lryshrd dwknz mjn `l~ mwq`https://t.co/hdwhBeEAvW   qr@ mmt`@ lljmy`...", ymknkm lan thmyl ktb lnhr lkhrj mn `dn lryshrd dwknz mjn `l~ mwq` qr mmt` lljmy`
RichardDawkins,"RT @RDFTranslations: dryft rygn trjmhy #frsy khtb #jdwy_wq`yt, tnh khtb #rychrd_dwkhynz (@RichardDawkins) khh bry mkhTb nwjwn nwsht...", dryft rygn trjmhy khtb `yt tnh khtb  khh bry mkhtb nwjwn nwsht
RichardDawkins,"RT @center4inquiry: Do Unto Someone Else, Thanks. - The Morning Heresy tries not to do unto others. https://t.co/Ei93s1hkSu", do unto someone else thanks   the morning heresy tries not to do unto others
RichardDawkins,"RT @center4inquiry: Bamboozling Tsunami - The perfect storm of news in the Morning Heresy.  https://t.co/zzt4FNMx8H 

Get all the news rele...", bamboozling tsunami   the perfect storm of news in the morning heresy get all the news rele
RichardDawkins,"RT @atheistie: ""Wife of detained Nigerian humanist pleads for 'proof of life'""

https://t.co/n0qGf3IhQi", wife of detained nigerian humanist pleads for proof of life
RichardDawkins,"RT @center4inquiry: Alien Salvation - Who will say-eee-ave our souls? The Morning Heresy. https://t.co/IWvCWPMhwc 

Get all the news releva...", alien salvation   who will say eee ave our souls the morning heresy get all the news releva
RichardDawkins,https://t.co/cMEFZyRywC,
RichardDawkins,https://t.co/oGMl9v31V3,
RichardDawkins,https://t.co/c60u8lPCBY,
RichardDawkins,"""Sharia, sharia or we die"". Every country has to overcome its backward religions to advance. Good on Sudan.",sharia sharia or we die every country has to overcome its backward religions to advance good on sudan
RichardDawkins,https://t.co/21VBrm59JK,
RichardDawkins,"When I've looked up a topic in Wikipedia that I know something about, I've always been very impressed. This gives m... https://t.co/ZyiqVxLp01",when ive looked up a topic in wikipedia that i know something about ive always been very impressed this gives m
RichardDawkins,"RT @center4inquiry: Absurdly Lopsided - The unfair and unbalanced Morning Heresy
https://t.co/coX9Wm2Iph 

Get all the news relevant to the...", absurdly lopsided   the unfair and unbalanced morning heresy get all the news relevant to the
RichardDawkins,"RT @center4inquiry: Colossal Moral Damage - The Morning Heresy catalogues the destruction.
https://t.co/ezJLQ9Id1Z 

Get all the news relev...", colossal moral damage   the morning heresy catalogues the destruction get all the news relev
RichardDawkins,"RT @center4inquiry: Presumably Alienable - The Morning Heresy whittles away the unnecessary news. https://t.co/S7Vi1KGnOy 

Get all the new...", presumably alienable   the morning heresy whittles away the unnecessary news get all the new
RichardDawkins,"""Despite the sincere intentions of its author,"" @JohnHMcWhorter says of ""White Fragility,"" ""the book diminishes Bla... https://t.co/BkXZzp71dD",despite the sincere intentions of its author says of white fragility the book diminishes bla
RichardDawkins,I'm a Nobody. The Harper's Letter was for Me. https://t.co/Of4jdQNx9d via @areomagazine,im a nobody the harpers letter was for me via
RichardDawkins,"Good conversation between Sam Harris and the doyen of behaviour geneticists Robert Plomin.

https://t.co/0K7n1bdrva",good conversation between sam harris and the doyen of behaviour geneticists robert plomin
RichardDawkins,"This is an illuminating essay by James Lindsay, explaining what we're up against.

https://t.co/scHGtw3S9K",this is an illuminating essay by james lindsay explaining what were up against
RichardDawkins,I confess I didn't know about the Uyghur Muslims until @MaajidNawaz went on hunger strike. But Maajid is a very goo... https://t.co/bERcsAzzxc,i confess i didnt know about the uyghur muslims until went on hunger strike but maajid is a very goo
RichardDawkins,"RT @center4inquiry: Fever Swamps - The Morning Heresy drains the news. https://t.co/EgF1AFxhkl 

Get all the news relevant to the secular,...", fever swamps   the morning heresy drains the news get all the news relevant to the secular
RichardDawkins,"RT @center4inquiry: It's a Joke - Choking on laughter with the Morning Heresy. https://t.co/R5CtXz7txh 

Get all the news relevant to the s...", its a joke   choking on laughter with the morning heresy get all the news relevant to the s
RichardDawkins,"The  heroic Maajid Nawaz (joint author with Sam Harris of ""Islam and the Future of Tolerance"") is on hunger strike... https://t.co/ifFDF5VhTD",the heroic maajid nawaz joint author with sam harris of islam and the future of tolerance is on hunger strike
RichardDawkins,"RT @center4inquiry: While We're Laughing, They're Recruiting - The Morning Heresy https://t.co/7wX3673iFg 

Get all the news relevant to th...", while were laughing theyre recruiting   the morning heresy get all the news relevant to th
RichardDawkins,"RT @center4inquiry: Organized Hypocrisy - The Morning Heresy https://t.co/5PKoEOflwg 

Get all the news relevant to the secular, skeptic, a...", organized hypocrisy   the morning heresy get all the news relevant to the secular skeptic a
RichardDawkins,Just over a month ago I dislocated my shoulder. The 15 mile drive to the Banbury Horton Hospital was excruciatingly... https://t.co/MusHqK50WM,just over a month ago i dislocated my shoulder the mile drive to the banbury horton hospital was excruciatingly
RichardDawkins,"The Coddling of the American Mind by Greg Lukianoff and Jonathan Haidt, audiobook read by @JonHaidt. Utterly superb... https://t.co/WUBP6Jry0z",the coddling of the american mind by greg lukianoff and jonathan haidt audiobook read by  utterly superb
RichardDawkins,"RT @center4inquiry: Graceless and Joyless - The Morning Heresy spills the news all over the place. https://t.co/BF9i0hsL7H 

Get all the ne...", graceless and joyless   the morning heresy spills the news all over the place get all the ne
RichardDawkins,https://t.co/PPhjb6stnq,
RichardDawkins,"Zachary Wood is a hero. He invited to campus controversial speakers with whom he disagreed, only to see them disinv... https://t.co/p1iEhsMn2h",zachary wood is a hero he invited to campus controversial speakers with whom he disagreed only to see them disinv
RichardDawkins,"""I had this great economy and they made me shut it down."" Covid is out to get ME ME ME but I'll win anyway.  While... https://t.co/7Dd4b6eSTm",i had this great economy and they made me shut it down covid is out to get me me me but ill win anyway while
RichardDawkins,"RT @center4inquiry: Who to Marginalize Next - The news from the outside looking in, The Morning Heresy. https://t.co/RbvvbqAHYU", who to marginalize next   the news from the outside looking in the morning heresy
RichardDawkins,https://t.co/mg3rNhBvRQ,
RichardDawkins,"New College Oxford (well, it was new in 1379) responded in timeless fashion to the temporary disruption caused by t... https://t.co/T7cPjhHZCU",new college oxford well it was new in  responded in timeless fashion to the temporary disruption caused by t
RichardDawkins,"RT @center4inquiry: 99 Percent Totally Harmless - Most of the links in The Morning Heresy are non-fatal. https://t.co/Y7tRXvLNur 

Get all...", percent totally harmless   most of the links in the morning heresy are non fatal get all
RichardDawkins,"Excellent letter in Harper's, signed by many leading intellectuals.

https://t.co/3iaMDEbob0",excellent letter in harpers signed by many leading intellectuals
RichardDawkins,https://t.co/SL26XQ2Xp4,
RichardDawkins,https://t.co/9EX3CXJ7mj,
RichardDawkins,https://t.co/2Gl0KEFnNZ,
RichardDawkins,"RT @center4inquiry: Fall Will Be Awful - The Morning Heresy https://t.co/04xncSp5Te

Get all the news relevant to the secular, skeptic, and...", fall will be awful   the morning heresy all the news relevant to the secular skeptic and
RichardDawkins,https://t.co/657I6ppfQC,
RichardDawkins,"RT @center4inquiry: Cause an Enormous Shudder - Cringe-worthy links at The Morning Heresy.
https://t.co/X18u7JgYWX 

Get all the news relev...", cause an enormous shudder   cringe worthy links at the morning heresy get all the news relev
RichardDawkins,"Joe Biden sounds suitably presidential in this Fourth of July pledge. It makes a nice change.

https://t.co/XaUTWRyTwI",joe biden sounds suitably presidential in this fourth of july pledge it makes a nice change
RichardDawkins,https://t.co/w6H8pdTWPF,
RichardDawkins,https://t.co/BNGXTHP3WI,
RichardDawkins,"Science and Reason. The Other channel. Reaching out to freethinkers in the Arab world:
https://t.co/NQs7N1Db3G",science and reason the other channel reaching out to freethinkers in the arab world
RichardDawkins,"RT @center4inquiry: Dead-Enders - The Morning Heresy walks face-first into the wall of news. https://t.co/UGLq8NtZ6N 

Get all the news rel...", dead enders   the morning heresy walks face first into the wall of news get all the news rel
RichardDawkins,https://t.co/TTHCpxZndJ,
RichardDawkins,"Please read this superb article by Thomas Friedman

https://t.co/A35NdCJeS2",please read this superb article by thomas friedman
RichardDawkins,"RT @center4inquiry: Erroneous Views - The Morning Heresy sees through the facade of the news, and then regrets it.
https://t.co/jFqEYnqyCa", erroneous views   the morning heresy sees through the facade of the news and then regrets it
RichardDawkins,"So far, more Americans have died from coronavirus than in the wars of Vietnam, Korea, Iraq and Afghanistan combined... https://t.co/Xj6tGotlNP",so far more americans have died from coronavirus than in the wars of vietnam korea iraq and afghanistan combined
RichardDawkins,RT @center4inquiry: CFI Denounces #SCOTUS #Espinoza Decision Forcing Taxpayers to Pay for Religious Schooling https://t.co/ir53stO2cb, cfi denounces decision forcing taxpayers to pay for religious schooling
RichardDawkins,RT @center4inquiry: Whoop! Whoop! Whoop! Bzzzzz! - All the news and the noise at The Morning Heresy. https://t.co/5N5eZrgfoU, whoop whoop whoop bzzzzz   all the news and the noise at the morning heresy
RichardDawkins,RT @center4inquiry: The Desire to Be Liked - The Morning Heresy collects links so you'll be its friend. https://t.co/upS4ggjx8W, the desire to be liked   the morning heresy collects links so youll be its friend
RichardDawkins,"Come to my rally and infect each other but, whatever else happens, make sure I don't get infected.
https://t.co/DjS8A7v1C9",come to my rally and infect each other but whatever else happens make sure i dont get infected
RichardDawkins,https://t.co/Q0srvkf4cv,
RichardDawkins,"RT @center4inquiry: The Devil's Trying to Give Me the Flu! - The Morning Heresy's links are the devil's playthings. 
https://t.co/mOfcwIuFSP", the devils trying to give me the flu   the morning heresys links are the devils playthings
RichardDawkins,Dumb Britain. Social distancing on Brighton Beach by people of very low intelligence.  American friend tells me she... https://t.co/EHhnCqvWZC,dumb britain social distancing on brighton beach by people of very low intelligence american friend tells me she
RichardDawkins,https://t.co/FcBqalejQF,
RichardDawkins,https://t.co/rFQXNaO7cw,
